FormId,FormType,Reference,Title,TitleData,Instructions,Width,Height
rid-del-doc-rb-attr-fg-link-form,DUC,rid-del-doc-rb-attr-fg-link,Delete Doc Radio Button Attribute to Filter Group Link,,,45%,15%
rid-del-doc-real-field-name-form,DUC,rid-del-doc-real-field-name,Delete Doc Real Number Field,,,45%,10%
rid-del-doc-real-value-form,DUC,rid-del-doc-real-value,Delete Doc Real Number Field Link,,,45%,15%
rid-del-doc-tag-form,DUC,rid-del-doc-tag,Delete Document Tag,,,45%,10%
rid-del-doc-text-field-name-form,DUC,rid-del-doc-text-field-name,Delete Doc Free Text Field,,,45%,10%
rid-del-doc-text-value-form,DUC,rid-del-doc-text-value,Delete Doc to Text Field Link,,,45%,15%
rid-del-doc-to-com-obj-ms-link-form,DUC,rid-del-doc-to-com-obj-ms-link,Delete Doc to Common Object Link via Multi-Select List,,,45%,20%
rid-del-doc-to-com-obj-rb-link-form,DUC,rid-del-doc-to-com-obj-rb-link,Delete Doc to Common Object Link via Radio Button List,,,45%,15%
rid-del-doc-to-function-link-form,DUC,rid-del-doc-to-function-link,Delete Doc to Duty Function Link,,,45%,20%
rid-del-doc-transaction-group-form,DUC,rid-del-doc-transaction-group,Delete Document Transaction Group,,,45%,10%
rid-del-document-id-form,DUC,rid-del-document-id,Delete Document ID,,,45%,10%
rid-del-doc-xref-form,DUC,rid-del-doc-xref,Delete Document Cross Reference Link,,,45%,15%
rid-del-duty-function-form,DUC,rid-del-duty-function,Delete Duty Function,,,45%,10%
rid-del-duty-function-sid-link-form,DUC,rid-del-duty-function-sid-link,Delete Duty Function to User Link,,,45%,15%
rid-del-file-date-field-name-form,DUC,rid-del-file-date-field-name,Delete File Date Field,,,45%,10%
rid-del-file-date-value-form,DUC,rid-del-file-date-value,Delete File to Date Field Link,,,45%,15%
rid-del-file-doc-link-form,DUC,rid-del-file-doc-link,Delete File to Doc Link,,,45%,15%
rid-del-file-form,DUC,rid-del-file,Delete File,,,45%,10%
rid-del-file-funct-list-link-form,DUC,rid-del-file-funct-list-link,Delete File to Duty Function List Link,,,45%,20%
rid-del-file-gp-ed-perm-funct-form,DUC,rid-del-file-gp-ed-perm-funct,Delete Edit Permission for User Function List to File Group,,,45%,15%
rid-del-file-gp-ed-perm-people-form,DUC,rid-del-file-gp-ed-perm-people,Delete File Group to People List Link for Edit Permission,,,45%,15%
rid-del-file-group-link-form,DUC,rid-del-file-group-link,Delete File to File Group Link,,,45%,15%
rid-del-file-group-name-form,DUC,rid-del-file-group-name,Delete File Group,,,45%,10%
rid-del-file-int-field-name-form,DUC,rid-del-file-int-field-name,Delete File Integer Field,,,45%,10%
rid-del-file-int-value-form,DUC,rid-del-file-int-value,Delete File to Integer Field Link,,,45%,15%
rid-del-file-ms-attr-fg-link-form,DUC,rid-del-file-ms-attr-fg-link,Delete File Multi-Select to Filter Group Link,,,45%,15%
rid-del-file-ms-attribute-form,DUC,rid-del-file-ms-attribute,Delete File Multi-Select Attribute,,,45%,10%
rid-del-file-ms-list-form,DUC,rid-del-file-ms-list,Delete File Multi-Select List,,,45%,10%
rid-del-file-multi-select-link-form,DUC,rid-del-file-multi-select-link,Delete File to Multi-Select Attribute Link,,,45%,20%
rid-del-file-people-list-link-form,DUC,rid-del-file-people-list-link,Delete File to People List Link,,,45%,20%
rid-del-file-radiob-attr-form,DUC,rid-del-file-radiob-attr,Delete File Radio Button List,,,45%,10%
rid-del-file-radiob-link-form,DUC,rid-del-file-radiob-link,Delete File to File Radio Button Link,,,45%,15%
rid-del-file-radiob-list-form,DUC,rid-del-file-radiob-list,Delete File Radio Button List,,,45%,10%
rid-del-file-rb-attr-fg-link-form,DUC,rid-del-file-rb-attr-fg-link,Delete File Radio Button Attribute to Filter Group Link,,,45%,15%
rid-del-file-real-field-name-form,DUC,rid-del-file-real-field-name,Delete File Real Number Field,,,45%,10%
rid-del-file-real-value-form,DUC,rid-del-file-real-value,Delete File Real Number Value,,,45%,15%
rid-del-file-text-field-name-form,DUC,rid-del-file-text-field-name,Delete File Text Field,,,45%,10%
rid-del-file-text-value-form,DUC,rid-del-file-text-value,Delete File to Text Field Link,,,45%,15%
rid-del-file-to-cm-obj-ms-link-form,DUC,rid-del-file-to-cm-obj-ms-link,Delete File to Common Object Link via Multi-Select List,,,45%,20%
rid-del-file-to-com-obj-rb-link-form,DUC,rid-del-file-to-com-obj-rb-link,Delete File to Common Object Link via Radio Button List,,,45%,15%
rid-del-file-to-function-link-form,DUC,rid-del-file-to-function-link,Delete File to Duty Function Link,,,45%,20%
rid-del-filter-group-form,DUC,rid-del-filter-group,Delete Filter Group,,,45%,10%
rid-del-fm-dc-c-ob-ms-def-form,DUC,rid-del-fm-dc-c-ob-ms-def,Delete Form Document Common Object Default,,,45%,20%
rid-del-fm-dc-c-ob-ms-lnk-form,DUC,rid-del-fm-dc-c-ob-ms-lnk,Delete Form to Document Common Object Multi-Select Field Link,,,45%,15%
rid-del-fm-dc-c-ob-rb-lnk-form,DUC,rid-del-fm-dc-c-ob-rb-lnk,Delete Form to Document Common Object Radio Button Field Link,,,45%,15%
rid-del-fm-doc-crtd-by-id-link-form,DUC,rid-del-fm-doc-crtd-by-id-link,Delete Form to Document Created-By-ID Field Link,,,45%,10%
rid-del-fm-doc-crtd-by-nm-link-form,DUC,rid-del-fm-doc-crtd-by-nm-link,Delete Form to Document Created-By-Name Field Link,,,45%,10%
rid-del-fm-doc-funct-lst-links-form,DUC,rid-del-fm-doc-funct-lst-links,Delete Form to Document Duty Function List Link,,,45%,10%
rid-del-fm-fl-c-ob-ms-lnk-form,DUC,rid-del-fm-fl-c-ob-ms-lnk,Delete Form to File Common Object Multi-Select Link,,,45%,15%
rid-del-fm-fl-c-ob-rb-lnk-form,DUC,rid-del-fm-fl-c-ob-rb-lnk,Delete Form to File Common Object Radio Button Link,,,45%,15%
rid-del-fm-fl-com-obj-ms-def-form,DUC,rid-del-fm-fl-com-obj-ms-def,Delete Form File Multi-Select Common Object Default,,,45%,20%
rid-del-fm-fl-crtd-by-id-link-form,DUC,rid-del-fm-fl-crtd-by-id-link,Delete Form to File Created-By-ID Field Link,,,45%,10%
rid-del-fm-fl-crtd-by-nm-link-form,DUC,rid-del-fm-fl-crtd-by-nm-link,Delete Form to File Created-By-Name Field Link,,,45%,10%
rid-del-fm-fl-funct-lst-links-form,DUC,rid-del-fm-fl-funct-lst-links,Delete Form to File Function List Field Link,,,45%,15%
rid-del-form-doc-created-link-form,DUC,rid-del-form-doc-created-link,Delete Form to Document Created Date Field Link,,,45%,10%
rid-del-form-doc-date-link-form,DUC,rid-del-form-doc-date-link,Delete Form to Document Date Name Field Link,,,45%,15%
rid-del-form-doc-int-link-form,DUC,rid-del-form-doc-int-link,Delete Form to Document Integer Field Link,,,45%,15%
rid-del-form-doc-lock-link-form,DUC,rid-del-form-doc-lock-link,Delete Form to Document Lock Status Field Link,,,45%,10%
rid-del-form-doc-ms-link-form,DUC,rid-del-form-doc-ms-link,Delete Form to Document Multi-Select Field Link,,,45%,15%
rid-del-form-doc-multi-sel-def-form,DUC,rid-del-form-doc-multi-sel-def,Delete Form to Document Multi-Select Object Default,,,45%,20%
rid-del-form-doc-radiob-link-form,DUC,rid-del-form-doc-radiob-link,Delete Form to Doc Radio Button List Field Link,,,45%,15%
rid-del-form-doc-real-link-form,DUC,rid-del-form-doc-real-link,Delete Form to Document Real Number Field Link,,,45%,15%
rid-del-form-doc-tr-grp-link-form,DUC,rid-del-form-doc-tr-grp-link,Delete Form to Document Transaction Group Field Link,,,45%,10%
rid-del-form-file-created-link-form,DUC,rid-del-form-file-created-link,Delete Form to File-Created Date Field,,,45%,10%
rid-del-form-file-date-link-form,DUC,rid-del-form-file-date-link,Delete Form to File Date Field Link,,,45%,15%
rid-del-form-file-hash-link-form,DUC,rid-del-form-file-hash-link,Delete Form to File Content Hash Field Link,,,45%,10%
rid-del-form-file-int-link-form,DUC,rid-del-form-file-int-link,Delete Form to File Integer Field Link,,,45%,15%
rid-del-form-file-ms-link-form,DUC,rid-del-form-file-ms-link,Delete Form to File Multi-Select List Link,,,45%,15%
rid-del-form-file-name-link-form,DUC,rid-del-form-file-name-link,Delete Form to Filename Field Link,,,45%,10%
rid-del-form-file-plist-links-form,DUC,rid-del-form-file-plist-links,Delete Form to File People List Link,,,45%,15%
rid-del-form-file-radiob-link-form,DUC,rid-del-form-file-radiob-link,Delete Form to File Radio Button List Field Link,,,45%,15%
rid-del-form-file-real-link-form,DUC,rid-del-form-file-real-link,Delete Form to File Real Number Field Link,,,45%,15%
rid-del-form-file-size-link-form,DUC,rid-del-form-file-size-link,Delete Form to File Size Field Link,,,45%,10%
rid-del-form-file-tr-grp-link-form,DUC,rid-del-form-file-tr-grp-link,Delete Form to File Transaction Group Field Link,,,45%,10%
rid-del-form-group-name-form,DUC,rid-del-form-group-name,Delete Form Group,,,45%,10%
rid-del-form-group-owner-form,DUC,rid-del-form-group-owner,Delete Form Group Owner,,,45%,15%
rid-del-frm-doc-free-txt-link-form,DUC,rid-del-frm-doc-free-txt-link,Delete Form to Document Free Text Field Link,,,45%,15%
rid-del-frm-doc-funct-links-form,DUC,rid-del-frm-doc-funct-links,Delete Form to Document Duty Function Field Link,,,45%,15%
rid-del-frm-doc-ppl-lst-lnks-form,DUC,rid-del-frm-doc-ppl-lst-lnks,Delete Form to Document People Field Link,,,45%,15%
rid-del-frm-file-free-txt-link-form,DUC,rid-del-frm-file-free-txt-link,Delete Form to File Free Text Field Link,,,45%,15%
rid-del-frm-file-funct-links-form,DUC,rid-del-frm-file-funct-links,Delete Form to File Duty Function Field Link,,,45%,15%
rid-del-frm-file-multi-sel-def-form,DUC,rid-del-frm-file-multi-sel-def,Delete Form to File Milti-Select Object Default,,,45%,20%
rid-del-function-list-form,DUC,rid-del-function-list,Delete Duty Function From Function List,,,45%,15%
rid-del-function-list-name-form,DUC,rid-del-function-list-name,Delete Duty Function List,,,45%,10%
rid-del-general-field-name-form,DUC,rid-del-general-field-name,Delete General Field Name,,,45%,10%
rid-del-indiv-br-tree-form,DUC,rid-del-indiv-br-tree,Delete Personal Browsing Tree,,,45%,10%
rid-del-people-list-form,DUC,rid-del-people-list,Delete User From People List,,,45%,15%
rid-del-people-list-name-form,DUC,rid-del-people-list-name,Delete People List,,,45%,10%
rid-del-restricted-form-id-form,DUC,rid-del-restricted-form-id,Delete Form ID,,,45%,10%
rid-del-sid-form,DUC,rid-del-sid,Delete User,,,45%,10%
rid-del-tag-browsing-tree-form,DUC,rid-del-tag-browsing-tree,Delete Tag Browsing Tree,,,45%,10%
rid-del-tag-br-tree-branch-form,DUC,rid-del-tag-br-tree-branch,Delete Tag Browsing Tree Branch,,,45%,10%
rid-del-tag-br-tr-perm-flist-form,DUC,rid-del-tag-br-tr-perm-flist,Delete Tag Browsing Tree to Function List Link,,,45%,15%
rid-del-tag-br-tr-perm-plist-form,DUC,rid-del-tag-br-tr-perm-plist,Revoke Tag Browsing Tree People List Edit Permission,,,45%,15%
rid-del-tag-doc-link-form,DUC,rid-del-tag-doc-link,Delete Tag to Document Link,,,45%,15%
rid-del-tag-group-id-name-form,DUC,rid-del-tag-group-id-name,Delete Tag Group,,,45%,10%
rid-del-tag-group-link-form,DUC,rid-del-tag-group-link,Delete Tag to Tag Group Link,,,45%,15%
rid-del-tag-group-perm-flist-form,DUC,rid-del-tag-group-perm-flist,Revoke Tag Group Authorisation,,,45%,15%
rid-del-tag-group-perm-plist-form,DUC,rid-del-tag-group-perm-plist,Revoke Tag Linking Authorisation for People List,,,45%,15%
rid-del-tag-tree-branch-form,DUC,rid-del-tag-tree-branch,Delete Tag Tree Branch,,,45%,10%
rid-del-tag-tree-form,DUC,rid-del-tag-tree,Delete Tag Tree,,,45%,10%
rid-del-tag-tree-node-form,DUC,rid-del-tag-tree-node,Delete Tag Tree Node,,,45%,10%
rid-del-tag-tree-perm-flist-form,DUC,rid-del-tag-tree-perm-flist,Revoke Tag Tree Edit Authorisation for Function List,,,45%,15%
rid-del-transaction-group-form,DUC,rid-del-transaction-group,Delete Transaction Group,,,45%,10%
rid-del-unit-of-measure-form,DUC,rid-del-unit-of-measure,Delete Unit of Measure,,,45%,10%
rid-del-user-role-form,DUC,rid-del-user-role,Revoke User Role,,,45%,15%
rid-del-wf-funct-output-file-form,DUC,rid-del-wf-funct-output-file,Delete File to Workflow Output Step For Function,,,45%,20%
rid-del-wf-input-step-file-form,DUC,rid-del-wf-input-step-file,Delete File to Workflow Input Step Link,,,45%,15%
rid-del-wf-people-output-file-form,DUC,rid-del-wf-people-output-file,Delete File to Workflow Output Step for Person,,,45%,20%
rid-del-wf-step-duty-funct-form,DUC,rid-del-wf-step-duty-funct,Delete Workflow Instance Step to Duty Function Link,,,45%,15%
rid-del-wf-step-status-defn-form,DUC,rid-del-wf-step-status-defn,Delete Workflow Step Status Definition,,,45%,10%
rid-del-workflow-action-form,DUC,rid-del-workflow-action,Delete Workflow Action,,,45%,10%
rid-del-workflow-instance-def-form,DUC,rid-del-workflow-instance-def,Delete Workflow Instance,,,45%,10%
rid-del-workflow-instance-step-form,DUC,rid-del-workflow-instance-step,Delete Workflow Instance Step,,,45%,10%
rid-del-workflow-model-form,DUC,rid-del-workflow-model,Delete Workflow Model,,,45%,10%
rid-del-workflow-output-def-form,DUC,rid-del-workflow-output-def,Delete Workflow Output Definition,,,45%,10%
rid-del-workflow-participant-form,DUC,rid-del-workflow-participant,Delete Workflow Instance Step to User Link,,,45%,15%
rid-del-workflow-rule-form,DUC,rid-del-workflow-rule,Delete Workflow Rule,,,45%,10%
rid-del-workflow-rule-link-form,DUC,rid-del-workflow-rule-link,Delete Workflow Rule to Workflow Step Link,,,45%,15%
rid-del-workflow-step-def-form,DUC,rid-del-workflow-step-def,Delete Workflow Step Definition,,,45%,10%
rid-del-workflow-step-transn-form,DUC,rid-del-workflow-step-transn,Delete Workflow Model Step Transition,,,45%,10%
rid-del-xref-type-form,DUC,rid-del-xref-type,Delete Cross Reference Type,,,45%,10%
rid-doc-group-perm-people-notes-update-form,DUC,rid-doc-group-perm-people-notes-update,Update Doc Group and People List Link Notes,,,45%,20%
rid-form-file-free-text-link-update-form,DUC,rid-form-file-free-text-link-update,Update Form to File Free Text Field Link,,,45%,45%
rid-ins-common-object-form,DUC,rid-ins-common-object,Create Common Object Record,,,45%,25%
rid-ins-common-object-lst-item-form,DUC,rid-ins-common-object-lst-item,Create Common Object List Item,,,45%,20%
rid-ins-com-obj-attribute-form,DUC,rid-ins-com-obj-attribute,Create Common Object Attribute,,,45%,20%
rid-ins-com-obj-list-name-form,DUC,rid-ins-com-obj-list-name,Create Common Object List,,,45%,25%
rid-ins-contr-doc-group-link-form,DUC,rid-ins-contr-doc-group-link,Create Doc to Controller Doc Group Link,,,45%,20%
rid-ins-contr-doc-group-name-form,DUC,rid-ins-contr-doc-group-name,Create Controller Document Group,,,45%,20%
rid-ins-contr-file-group-link-form,DUC,rid-ins-contr-file-group-link,Create File to Controller File Group Link,,,45%,20%
rid-ins-contr-file-group-name-form,DUC,rid-ins-contr-file-group-name,Create Controller File Group,,,45%,20%
rid-ins-doc-date-field-name-form,DUC,rid-ins-doc-date-field-name,Create Document Date Field,,,45%,20%
rid-ins-doc-date-value-form,DUC,rid-ins-doc-date-value,Create Doc Date Value,,,45%,20%
rid-ins-doc-function-link-form,DUC,rid-ins-doc-function-link,Create Doc to Duty Function Link,,,45%,20%
rid-ins-doc-funct-list-link-form,DUC,rid-ins-doc-funct-list-link,Create Doc to Duty Function List Link,,,45%,20%
rid-ins-doc-gp-ed-perm-funct-form,DUC,rid-ins-doc-gp-ed-perm-funct,Create a Doc Group Edit Permission to Function List Link,,,45%,20%
rid-ins-doc-gp-ed-perm-people-form,DUC,rid-ins-doc-gp-ed-perm-people,Create Doc Group Edit Permission to People List Link,,,45%,20%
rid-ins-doc-group-link-restr-form,DUC,rid-ins-doc-group-link-restr,Create Doc to Doc Group Link for Connected User,,,45%,20%
rid-ins-doc-group-name-form,DUC,rid-ins-doc-group-name,Create Document Group,,,45%,20%
rid-ins-doc-int-field-name-form,DUC,rid-ins-doc-int-field-name,Create Document Integer Field,,,45%,25%
rid-ins-doc-int-value-form,DUC,rid-ins-doc-int-value,Create Doc Integer Value,,,45%,20%
rid-ins-doc-ms-attr-fg-link-form,DUC,rid-ins-doc-ms-attr-fg-link,Create Doc Multi-Select Attribute to Filter Group Link,,,45%,15%
rid-ins-doc-ms-attribute-form,DUC,rid-ins-doc-ms-attribute,Create Document Multi-Select Attribute,,,45%,30%
rid-ins-doc-multi-select-link-form,DUC,rid-ins-doc-multi-select-link,Create Doc to Multi-Select List Attribute Link,,,45%,20%
rid-ins-doc-multi-select-list-form,DUC,rid-ins-doc-multi-select-list,Create Document Multi-Select List,,,45%,20%
rid-ins-doc-people-list-link-form,DUC,rid-ins-doc-people-list-link,Create Document to People List Link,,,45%,20%
rid-ins-doc-radiob-attr-form,DUC,rid-ins-doc-radiob-attr,Create Document Radio Button Attribute,,,45%,30%
rid-ins-doc-radiob-link-form,DUC,rid-ins-doc-radiob-link,Create Doc Radio Button Attribute Link,,,45%,20%
rid-ins-doc-rb-attr-fg-link-form,DUC,rid-ins-doc-rb-attr-fg-link,Create Doc Radio Button Attribute to Filter Group Link,,,45%,15%
rid-ins-doc-real-field-name-form,DUC,rid-ins-doc-real-field-name,Create Document Real Number Field,,,45%,25%
rid-ins-doc-real-value-form,DUC,rid-ins-doc-real-value,Create Doc Real Number Value,,,45%,20%
rid-ins-doc-tag-form,DUC,rid-ins-doc-tag,Create Document Tag,,,45%,25%
rid-ins-doc-text-field-name-form,DUC,rid-ins-doc-text-field-name,Create Document Free Text Field,,,45%,20%
rid-ins-doc-text-value-form,DUC,rid-ins-doc-text-value,Create Doc Text Value,,,45%,20%
rid-ins-doc-to-com-obj-ms-link-form,DUC,rid-ins-doc-to-com-obj-ms-link,Create Doc to Common Object Link via Multi-Select List,,,45%,20%
rid-ins-doc-to-com-obj-rb-link-form,DUC,rid-ins-doc-to-com-obj-rb-link,Create Doc to Common Object Link via Radio Button List,,,45%,20%
rid-ins-document-id-restr-form,DUC,rid-ins-document-id-restr,Create Doc ID With Doc Group for Connected User,,,45%,25%
rid-ins-doc-xref-form,DUC,rid-ins-doc-xref,Create Document Cross Reference Link,,,45%,25%
rid-ins-duty-function-form,DUC,rid-ins-duty-function,Create Duty Function,,,45%,20%
rid-ins-duty-function-sid-link-form,DUC,rid-ins-duty-function-sid-link,Create Duty Function to User Link,,,45%,20%
rid-ins-file-binary-input-form,DUC,rid-ins-file-binary-input,Upload a File,,,45%,20%
rid-ins-file-date-field-name-form,DUC,rid-ins-file-date-field-name,Create File Date Field,,,45%,20%
rid-ins-file-date-value-form,DUC,rid-ins-file-date-value,Create File Date Value,,,45%,20%
rid-ins-file-doc-link-form,DUC,rid-ins-file-doc-link,Create File to Doc Link,,,45%,20%
rid-ins-file-function-link-form,DUC,rid-ins-file-function-link,Create File to Duty Function Link,,,45%,20%
rid-ins-file-funct-list-link-form,DUC,rid-ins-file-funct-list-link,Create File to Duty Function List Link,,,45%,20%
rid-ins-file-gp-ed-perm-funct-form,DUC,rid-ins-file-gp-ed-perm-funct,Create Edit Permission for User Function List to File Group,,,45%,20%
rid-ins-file-gp-ed-perm-people-form,DUC,rid-ins-file-gp-ed-perm-people,Create File Group to People List Link for Edit Permission,,,45%,20%
rid-ins-file-group-link-form,DUC,rid-ins-file-group-link,Create File to File Group Link,,,45%,20%
rid-ins-file-group-name-form,DUC,rid-ins-file-group-name,Create File Group Name,,,45%,20%
rid-ins-file-int-field-name-form,DUC,rid-ins-file-int-field-name,Create File Integer Field,,,45%,25%
rid-ins-file-int-value-form,DUC,rid-ins-file-int-value,Create File Integer Field Value,,,45%,20%
rid-ins-file-ms-attr-fg-link-form,DUC,rid-ins-file-ms-attr-fg-link,Create File Multi-Select Attribute to Filter Group Link,,,45%,15%
rid-ins-file-ms-attribute-form,DUC,rid-ins-file-ms-attribute,Create File Multi-Select Attribute,,,45%,30%
rid-ins-file-multi-select-link-form,DUC,rid-ins-file-multi-select-link,Create File to Multi-Select Attribute Link,,,45%,20%
rid-ins-file-multi-select-list-form,DUC,rid-ins-file-multi-select-list,Create File Multi-Select List,,,45%,20%
rid-ins-file-people-list-link-form,DUC,rid-ins-file-people-list-link,Create File to People List Link,,,45%,20%
rid-ins-file-radiob-attr-form,DUC,rid-ins-file-radiob-attr,Create File Radio Button Attribute,,,45%,30%
rid-ins-file-radiob-link-form,DUC,rid-ins-file-radiob-link,Create File to File Radio Button Attribute Link,,,45%,20%
rid-ins-file-radiob-list-form,DUC,rid-ins-file-radiob-list,Create File Radio Button Attribute List,,,45%,30%
rid-ins-file-rb-attr-fg-link-form,DUC,rid-ins-file-rb-attr-fg-link,Create File Radio Button Attribute to Filter Group Link,,,45%,15%
rid-ins-file-real-field-name-form,DUC,rid-ins-file-real-field-name,Create File Real Number Field,,,45%,25%
rid-ins-file-real-value-form,DUC,rid-ins-file-real-value,Create File Real Number Value,,,45%,20%
rid-ins-file-text-field-name-form,DUC,rid-ins-file-text-field-name,Create File Free Text Field,,,45%,20%
rid-ins-file-text-value-form,DUC,rid-ins-file-text-value,Create File Text Field Value,,,45%,20%
rid-ins-file-to-com-obj-ms-lnk-form,DUC,rid-ins-file-to-com-obj-ms-lnk,Create File to Common Object Link via Multi-Select List,,,45%,20%
rid-ins-file-to-com-obj-radiob-lnk-form,DUC,rid-ins-file-to-com-obj-radiob-lnk,Create File to Common Object Link via Radio Button List,,,45%,20%
rid-ins-filter-group-form,DUC,rid-ins-filter-group,Create Filter Group,,,45%,20%
rid-ins-fm-dc-c-ob-ms-def-form,DUC,rid-ins-fm-dc-c-ob-ms-def,Create Form Document Common Object Default,,,45%,20%
rid-ins-fm-dc-c-ob-ms-lnk-form,DUC,rid-ins-fm-dc-c-ob-ms-lnk,Create Form to Document Common Object Multi-Select List Link,,,45%,45%
rid-ins-fm-dc-c-ob-rb-lnk-form,DUC,rid-ins-fm-dc-c-ob-rb-lnk,Create Form to Document Common Object Radio Button Link,,,45%,45%
rid-ins-fm-doc-crtd-by-id-link-form,DUC,rid-ins-fm-doc-crtd-by-id-link,Create Form to Document-Created-By-ID Field Link,,,45%,35%
rid-ins-fm-doc-crtd-by-nm-link-form,DUC,rid-ins-fm-doc-crtd-by-nm-link,Create Form to Document-Created-By-Name Field Link,,,45%,35%
rid-ins-fm-doc-funct-lst-links-form,DUC,rid-ins-fm-doc-funct-lst-links,Create Form to Document Duty Function List Field Link,,,45%,40%
rid-ins-fm-fl-c-ob-ms-lnk-form,DUC,rid-ins-fm-fl-c-ob-ms-lnk,Create Form to File Common Object Multi-Select Link,,,45%,45%
rid-ins-fm-fl-c-ob-rb-lnk-form,DUC,rid-ins-fm-fl-c-ob-rb-lnk,Create Form to File Common Object Radio Button Object Link,,,45%,45%
rid-ins-fm-fl-com-obj-ms-def-form,DUC,rid-ins-fm-fl-com-obj-ms-def,Create Form File Common Object Default,,,45%,20%
rid-ins-fm-fl-crtd-by-id-link-form,DUC,rid-ins-fm-fl-crtd-by-id-link,Create Form to File-Created-By-ID Field Link,,,45%,35%
rid-ins-fm-fl-crtd-by-nm-link-form,DUC,rid-ins-fm-fl-crtd-by-nm-link,Create Form to File-Created-By-Name Field Link,,,45%,35%
rid-ins-fm-fl-funct-lst-links-form,DUC,rid-ins-fm-fl-funct-lst-links,Create Form to File Duty Function List Field Link,,,45%,45%
rid-ins-form-doc-created-link-form,DUC,rid-ins-form-doc-created-link,Create Form to Document-Created-Date Field Link,,,45%,35%
rid-ins-form-doc-date-link-form,DUC,rid-ins-form-doc-date-link,Create Form to Document Date Name Field Link,,,45%,45%
rid-ins-form-doc-free-text-lnk-form,DUC,rid-ins-form-doc-free-text-lnk,Create Form to Document Free Text Field Link,,,45%,45%
rid-ins-form-doc-int-lnk-form,DUC,rid-ins-form-doc-int-lnk,Create Form to Document Integer Field Link,,,45%,45%
rid-ins-form-doc-lock-link-form,DUC,rid-ins-form-doc-lock-link,Create Form to Document Lock Status Field Link,,,45%,40%
rid-ins-form-doc-ms-link-form,DUC,rid-ins-form-doc-ms-link,Create Form to Document Multi-Select Field Link,,,45%,45%
rid-ins-form-doc-multi-sel-def-form,DUC,rid-ins-form-doc-multi-sel-def,Create Form to Document Multi-Select Object Default,,,45%,20%
rid-ins-form-doc-radiob-link-form,DUC,rid-ins-form-doc-radiob-link,Create Form to Document Radio Button List Link,,,45%,50%
rid-ins-form-doc-real-link-form,DUC,rid-ins-form-doc-real-link,Create Form to Document Real Number Field Link,,,45%,45%
rid-ins-form-doc-tr-grp-link-form,DUC,rid-ins-form-doc-tr-grp-link,Create Form to Document Transaction Group Field Link,,,45%,40%
rid-ins-form-file-created-link-form,DUC,rid-ins-form-file-created-link,Create Form to File-Created-Date Field Link,,,45%,10%
rid-ins-form-file-date-link-form,DUC,rid-ins-form-file-date-link,Create Form to File Date Field Link,,,45%,45%
rid-ins-form-file-free-txt-lnk-form,DUC,rid-ins-form-file-free-txt-lnk,Create Form to File Free Text Field Link,,,45%,45%
rid-ins-form-file-hash-link-form,DUC,rid-ins-form-file-hash-link,Create Form to File Content Hash Field Link,,,45%,40%
rid-ins-form-file-int-lnk-form,DUC,rid-ins-form-file-int-lnk,Create Form to File Integer Field Link,,,45%,45%
rid-ins-form-file-ms-link-form,DUC,rid-ins-form-file-ms-link,Create Form to File Multi-Select List Link,,,45%,45%
rid-ins-form-file-name-link-form,DUC,rid-ins-form-file-name-link,Create Form to Filename Field Link,,,45%,40%
rid-ins-form-file-plist-links-form,DUC,rid-ins-form-file-plist-links,Create Form to File People List Field Link,,,45%,45%
rid-ins-form-file-radiob-link-form,DUC,rid-ins-form-file-radiob-link,Create Form to File Radio Button List Field Link,,,45%,50%
rid-ins-form-file-real-link-form,DUC,rid-ins-form-file-real-link,Create Form to File Real Number Field Link,,,45%,45%
rid-ins-form-file-size-link-form,DUC,rid-ins-form-file-size-link,Create Form to File Size Field Link,,,45%,40%
rid-ins-form-file-tr-grp-link-form,DUC,rid-ins-form-file-tr-grp-link,Create Form to File Transaction Group Link,,,45%,40%
rid-ins-form-group-name-form,DUC,rid-ins-form-group-name,Create Form Group Name,,,45%,20%
rid-ins-form-id-name-form,DUC,rid-ins-form-id-name,Create Form,,,45%,30%
rid-ins-frm-doc-funct-links-form,DUC,rid-ins-frm-doc-funct-links,Create Form to Document Duty Function Field Link,,,45%,45%
rid-ins-frm-doc-ppl-lst-lnks-form,DUC,rid-ins-frm-doc-ppl-lst-lnks,Create Form to Document People List Field Link,,,45%,45%
rid-ins-frm-file-funct-links-form,DUC,rid-ins-frm-file-funct-links,Create Form to File Duty Function Field Link,,,45%,45%
rid-ins-frm-file-multi-sel-def-form,DUC,rid-ins-frm-file-multi-sel-def,Create Form to File Multi-Select Object Default,,,45%,20%
rid-ins-function-list-form,DUC,rid-ins-function-list,Create Duty Function,,,45%,20%
rid-ins-function-list-name-form,DUC,rid-ins-function-list-name,Create Duty Function List,,,45%,20%
rid-ins-general-field-name-form,DUC,rid-ins-general-field-name,Create General Field Name,,,45%,25%
rid-ins-grant-authoriser-form,DUC,rid-ins-grant-authoriser,Grant Authorizer,,,45%,15%
rid-ins-people-list-form,DUC,rid-ins-people-list,Add User To People List,,,45%,20%
