FormId,FormType,Reference,Title,TitleData,Instructions,Width,Height
workflow-step-transn-form,READ,workflow-step-transn,Step Transition Details,,,45%,10%
all-people-list-names-form,READ,all-people-list-names,All People Lists,,,45%,10%
people-lists-for-connected-user-form,READ,people-lists-for-connected-user,People Lists for Connected User,,,45%,10%
non-pers-pple-lst-nms-form,READ,non-pers-pple-lst-nms,Non-Personal People Lists,,,45%,10%
rid-upd-tag-group-perm-plist-form,DUC,rid-upd-tag-group-perm-plist,Update a record to authorize people list members to link tags to a tag group. ,,,45%,30%
rid-upd-tag-tree-perm-plist-form,DUC,rid-upd-tag-tree-perm-plist,Update a record to authorize people list members to edit a tag tree.,,,45%,30%
rid-upd-tag-br-tr-perm-plist-form,DUC,rid-upd-tag-br-tr-perm-plist,Update a record to authorize people list members to edit a tag browsing tree.,,,45%,30%
rid-upd-tag-tree-perm-flist-form,DUC,rid-upd-tag-tree-perm-flist,Update a record to authorize function list members to edit a tag tree.,,,45%,30%
rid-upd-tag-group-perm-flist-form,DUC,rid-upd-tag-group-perm-flist,Update a record to authorize function list members to link tags to a tag group.,,,45%,30%
rid-upd-tag-br-tr-perm-flist-form,DUC,rid-upd-tag-br-tr-perm-flist,Update a record to authorize function list members to edit a tag browsing tree.,,,45%,30%
rid-restore-sid-form,DUC,rid-restore-sid,Restore a deactivated user.,,,45%,30%
workflow-model-step-direct,PASSTHROUGH,,Workflow Model Step ID,,,20%,10%
step-transition-id-direct-form,PASSTHROUGH,,Workflow Step Transition ID,,,20%,10%
workflow-instance-step-id-direct-form,PASSTHROUGH,,Workflow Instance Step ID,,,20%,10%
present-step-id-direct-form,PASSTHROUGH,,Workflow Present Step ID,,,20%,10%
workflow-instance-id-direct-form,PASSTHROUGH,,Workflow Instance ID,,,20%,10%
sel-one-file-data-form-direct-passthrough,PASSTHROUGH,,Select One File,,,45%,15%
bookings-by-user-form,READ,booking-ids-by-sidid,Document Booking Transactions by User,,,45%,10%
booking-ids-by-docid-form,READ,booking-ids-by-docid,Document Booking Transactions by Document,,,45%,10%
booking-ids-by-date-form,READ,booking-ids-by-date,Document Booking Transactions by Date,,,45%,20%
book-in-files-form,READ,book-in-files,Files for a Given Document Booking Transaction,,,45%,20%
rid-ins-book-in-form,DUC,rid-ins-book-in,Book a Document In,,,45%,40%
rid-ins-book-in-file-form,DUC,rid-ins-book-in-file,Book In Files To a Document,,,45%,20%
rid-del-book-in-id-form,DUC,rid-del-book-in-id,Delete Book In Transaction,,,45%,20%
rid-ins-book-out-form,DUC,rid-ins-book-out,Book a Document Out,,,45%,20%
browsing-trees-by-tag-form,READ,browsing-trees-by-tag,Tag Browsing Trees by Tag,,,45%,20%
rid-ins-file-user-link-form,DUC,rid-ins-file-user-link,Insert File to User Link,,,45%,20%
rid-ins-doc-user-link-form,DUC,rid-ins-doc-user-link,Insert Document to User Link,,,45%,20%
rid-del-doc-user-link-form,DUC,rid-del-doc-user-link,Delete Document to User Link,,,45%,20%
rid-del-file-user-link-form,DUC,rid-del-file-user-link,Delete File to User Link,,,45%,20%
rid-ins-frm-doc-user-lnks-form,DUC,rid-ins-frm-doc-user-lnks,Create Form Document to User Link,,,45%,45%
rid-ins-frm-file-user-lnks-form,DUC,rid-ins-frm-file-user-lnks,Create Form File to User Link,,,45%,45%
rid-upd-frm-doc-user-lnks-form,DUC,rid-upd-frm-doc-user-lnks,Update Form Document to User Link,,,45%,45%
rid-upd-frm-file-user-lnks-form,DUC,rid-upd-frm-file-user-lnks,Update Form File to User Link,,,45%,45%
rid-del-frm-file-user-lnks-form,DUC,rid-del-frm-file-user-lnks,Delete Form File to User Link,,,45%,20%
rid-del-frm-doc-user-lnks-form,DUC,rid-del-frm-doc-user-lnks,Delete Form Document to User Link,,,45%,20%
users-by-doc-form,READ,reading.usp_SEL_users_by_doc,Users Linked to a Document,,,45%,20%
users-by-file-form,READ,reading.usp_SEL_users_by_file,Users Linked to a File,,,45%,20%
docs-by-user-form,READ,reading.usp_SEL_docs_by_user,Documents Linked to a User (Filtered),,,45%,20%
all-docs-by-user-form,READ,reading.usp_SEL_all_docs_by_user,Documents Linked to a User (Unfiltered),,,45%,20%
docs-by-user-fgn-form,READ,reading.usp_SEL_docs_by_user_fgn,Documents Linked by User Field Name (Filtered),,,45%,20%
all-docs-by-user-fgn-form,READ,reading.usp_SEL_all_docs_by_user_fgn,Documents Linked by User Field Name (Unfiltered),,,45%,20%
files-by-user-form,READ,reading.usp_SEL_files_by_user,Files Linked to a User (Filtered),,,45%,20%
all-files-by-user-form,READ,reading.usp_SEL_all_files_by_user,Files Linked to a User (Unfiltered),,,45%,20%
files-by-user-fgn-form,READ,reading.usp_SEL_files_by_user_fgn,Files Linked to a User Field Name (Filtered),,,45%,20%
all-files-by-user-fgn-form,READ,reading.usp_SEL_all_fl_by_user_fgn,Files Linked to a User Field Name (Unfiltered),,,45%,20%
