TableName,StoredProcedure,DataField,RouteUrl,ApiEndpoint,KeyColumns,HiddenColumns,DisplayName,DefaultSort,Role,InputParameters,OutputParameters,DisplayParameters,Description,UseTransform
all-doc-group-names,authorising.usp_SEL_all_doc_group_names,docGroupNames,/reading/all-doc-group-names,document-group/names/read,Doc Group ID::Doc Group Name,Doc Group ID,All Document Group Names,,authoriser,,transactionMessage;transactionStatus ,,Lists all document group names.,
all-doc-group-viewers,authorising.usp_SEL_all_doc_group_viewers,viewersData,/reading/all-doc-group-viewers,document-group/viewers/read,User ID::System Username;Doc Group ID::Doc Group Name,User ID;Doc Group ID,All Document Group Viewers,,authoriser,,transactionMessage;transactionStatus ;numberOfRows,,Selects all document group viewers.,
all-form-group-owners,authorising.usp_SEL_all_form_group_owners,ownersData,/reading/all-form-group-owners,form/owners/read,User ID::System Username;Form Group ID::Form Group Name,User ID;Form Group ID,All Form Group Owners,,authoriser,,transactionMessage;transactionStatus ,,Lists all form group owners.,
read-all-user-roles,authorising.usp_SEL_all_user_roles,usersRoles,/reading/read-all-user-roles,users/roles/read,Role Name::Role Name;User ID::System Username,User ID,All User Roles,,authoriser,,transactionMessage;transactionStatus;numberOfRows,,Selects all records of user role permissions from the user_role_link table.,
authoriser-requests,authorising.usp_SEL_authoriser_requests,data,/reading/authoriser-requests,authoriser-requests/read,Request ID::Request ID;User ID::System Username,User ID;Request ID;Approver 1 User ID;Approver 2 User ID,Authorizer Requests,,authoriser,,transactionMessage;transactionStatus,,Selects authoriser requests.,
authorisers,authorising.usp_SEL_authorisers,data,/reading/authorisers,authorisers/read,User ID::System Username,User ID,Authorizers,,authoriser,,transactionMessage;transactionStatus,,Selects all authorisers.,
contr-doc-group-names,authorising.usp_SEL_contr_doc_group_names,controllerDocGroupNames,/document-edit-group/controller/read,document-edit-group/controller/read,Controller Doc Group ID::Controller Doc Group Name,Controller Doc Group ID,Controller Document Group Names,,authoriser,,transactionMessage;transactionStatus ,,Reads all controller level document edit groups.,
contr-doc-group-sids,authorising.usp_SEL_contr_doc_group_sids,resultSets,/reading/contr-doc-group-sids,user/controller/document-group/sid/read,User ID::System Username;Controller Doc Group ID::Controller Doc Group ID,User ID;Controller Doc Group ID,Controller Document Group Users,,authoriser,controllerDocEditGroupNameId,transactionMessage;transactionStatus ;numRecords,Controller Document Group ID: |controllerDocEditGroupNameId,Lists all of the users for a given controller level document group.,
contr-file-group-names,authorising.usp_SEL_contr_file_group_names,controllerFileGroupNames,/file/controller-file-group/name/read,file/controller-file-group/name/read,Controller File Group ID::Controller File Group Name,Controller File Group ID,Controller File Group Names,,authoriser,,transactionMessage;transactionStatus ,,Reads all controller level file edit groups.,
contr-file-group-sids,authorising.usp_SEL_contr_file_group_sids,resultSets,/reading/contr-file-group-sids,user/controller-file-group/read,User ID::System Username;Controller File Group ID::Controller File Group ID,User ID;Controller File Group ID,Controller File Group Users. ,,authoriser,controllerFileEditGroupNameId,transactionMessage;transactionStatus ;numRecords,Controller File Group ID: | controllerFileEditGroupNameId,Lists all of the users for a given controller level file group.,
read-privileges-by-user,authorising.usp_SEL_privileges_by_user,privilegesData,/reading/privileges-by-user,privileges-by-user/read,,,Privileges by User: ,,authoriser,userId,transactionMessage;transactionStatus,| userId,Lists privileges for a given user.,
read-revoke-log,authorising.usp_SEL_revoke_log,revokeLogData,/reading/revoke-log,revoke-log/read,User ID::System Username,User ID,Revoke Log,,authoriser,,transactionMessage;transactionStatus,,Lists the entries from the privileges revoke log,
roles-by-user,authorising.usp_SEL_roles_by_user,rolesData,/roles-by-user,roles-by-user,User ID::User ID;Role Name::Role Name,User ID,Roles for User: ,,authoriser,userId,transactionMessage;transactionStatus;numberOfDocs;formName;filterGroupName,| userId,List roles for a given user,
users-by-role,authorising.usp_SEL_users_by_role,usersData,/reading/users-by-role,user/role/read,User ID::System Username;Role Name::Role Name,User ID;Role Name,Users By Role,,authoriser,roleName,transactionMessage;transactionStatus , : | roleName,Select all users for a given role (not including authorisers).,
all-people-list-names,controlling.usp_SEL_all_people_list_names,dropDownOptions,/reading/all-people-list-names,people-list-names/read-all,People List ID::People List Name,People List ID;List Position,All People List Names,,controller,,transactionMessage;transactionStatus,,Lists all people list name records.,
all-people-lists,controlling.usp_SEL_all_people_lists,ResultSets,/reading/all-people-lists,people-list/read,People List ID::People List Name;User ID::System Username,People List ID;User ID;Person List Position;Person SID Record ID;People List Mnemonic;User ID,All People Lists,,controller,,transactionMessage;transactionStatus,,Lists all people list records.,
all-recent-sids,controlling.usp_SEL_all_recent_sids,data,/reading/all-recent-sids,all-recent-sids/read,User ID::System Username,User ID,All Recently Onboarded Users,,authoriser,minutes,transactionMessage;transactionStatus;numberOfRows, : | minutes,Selects all recently active SIDs.,
all-users,controlling.usp_SEL_all_sid_list,sidList,/list-all-users,list-users,User ID::System Username,User ID,All Users,System Username,controller,,transactionMessage;transactionStatus;numberOfRows,,Selects all users.,
controller-documents,controlling.usp_SEL_contr_dc_grp_lnks_rstr,documentData,/reading/documents-for-controller,document/controller-documents/read,Document ID::Document ID,,All Documents for Document Controller,,controller,formId,transactionMessage;transactionStatus;numRows;numDocs,| formId,Selects document metadata for all documents which the controller connected user has rights to.,TRUE
contr-doc-groups-restr,controlling.usp_SEL_contr_doc_groups_restr,resultSets,/reading/contr-doc-groups-restr,user/controller/document-group/restricted/read,Controller Doc Group ID::Controller Doc Group Name,Controller Doc Group ID,Controller Document Groups Restr,,controller,,transactionMessage;transactionStatus;numRows,,Lists all of the controller level document groups that the connected user has rights to.,
contr-file-groups-rstr,controlling.usp_SEL_contr_file_groups_rstr,resultSets,/reading/contr-file-groups-rstr,user/controller-file-group/restricted/read,Controller File Group ID::Controller File Group Name,Controller File Group ID,Controller File Groups Restricted,,controller,,transactionMessage;transactionStatus;numRows,,Lists all of the controller level file groups that the connected user has rights to.,
controller-files,controlling.usp_SEL_contr_fl_grp_lnks_rstr,fileData,/reading/files-for-controller,file/controller-files/read,File ID::Filename,,All Files for Document Controller,,controller,formId,transactionMessage;transactionStatus;numRows;numFiles,| formId,Selects file metadata for all the files which a controller connected user has rights to,TRUE
controllers-form-groups,controlling.usp_SEL_controllers_form_groups,resultSets,/reading/controllers-form-groups,form/form-group/read,Form Group ID::Form Group Name,Form Group ID,Controllers Form Groups,,controller,,transactionMessage;transactionStatus,,Lists all the form groups which the connnected user (controller) owns.,
controllers-forms,controlling.usp_SEL_controllers_forms,resultSets,/reading/controllers-forms,form/form-group/edit-permission/read,Form ID::Form Name;Form Group ID::Form Group Name,Form ID;Form Group ID;List Position,Controllers Forms,,controller,,transactionMessage;transactionStatus;numberOfRows,,Lists all forms which the connected user (controller) has permission to modify.,
del-log-by-file-id,controlling.usp_SEL_del_log_by_file_id,data,/reading/del-log-by-file-id,del-log-by-file-id/read,File ID::Filename;Deleted by User ID::Deleted by Username,Deleted by User ID;Created by User ID,Delete Log Records By File ID,,controller,fileId,transactionMessage;transactionStatus;numrows, : | fileId,Selects deletion log entries for a specific file ID.,
del-log-by-filename,controlling.usp_SEL_del_log_by_filename,data,/reading/del-log-by-filename,del-log-by-filename/read,File ID::Filename;Deleted by User ID::Deleted by Username,Created by User ID;Deleted by User ID,Delete Log Records By Filename,,controller,likeString,transactionMessage;transactionStatus;numrows, : | likeString,Selects deletion log entries by filename pattern.,
del-log-by-sid-id,controlling.usp_SEL_del_log_by_sid_id,data,/reading/del-log-by-sid-id,del-log-by-sid-id/read,User ID::System Username,,Delete Log Records By User ID,,controller,userId,transactionMessage;transactionStatus;numrows, : | userId,Selects deletion log entries for a specific user SID.,
del-log-by-username,controlling.usp_SEL_del_log_by_username,data,/reading/del-log-by-username,del-log-by-username/read,Deleted by User ID::Deleted by Username,,Delete Log Records By Username. ,,controller,likeString,transactionMessage;transactionStatus;numrows,Contains :|likestring,Selects deletion log entries by username pattern.,
del-log-date-between,controlling.usp_SEL_del_log_date_between,data,/reading/del-log-date-between,del-log-date-between/read,File ID::Filename;Deleted by User ID::Deleted by Username,Created by User ID;Deleted by User ID,Delete Log Records Date Between,,controller,earlierDate;laterDate,transactionMessage;transactionStatus;numrows,,Selects deletion log entries between specified dates.,
dg-ed-perm-funct-list,controlling.usp_SEL_dg_ed_perm_funct_list,resultSets,/reading/dg-ed-perm-funct-list,document-group/edit-permission/function-list/read,Doc Group ID::Doc Group Name;Function List ID::Function List Name,Doc Group ID;Function List ID,Document Group Edit Permission Funct List,,controller,,transactionMessage;transactionStatus,,Selects all records of document group to function list links. Only lists document groups for which the user has view permission.,
dg-ed-perm-people-list,controlling.usp_SEL_dg_ed_perm_people_list,resultSets,/reading/dg-ed-perm-people-list,document-group/edit-permission/people-list/read,Doc Group ID::Doc Group Name;People List ID::People List Name,Doc Group ID;People List ID,Document Group Edit Permission People List,,controller,,transactionMessage;transactionStatus,,Selects all records of document group to people list links. Only lists document groups for which the user has view permission.,
doc-groups-by-f-list,controlling.usp_SEL_doc_groups_by_f_list,resultSets,/reading/doc-groups-by-f-list,document-groups/function-list/read,Document Group ID::Document Group Name;Function List ID::Function List ID,Document Group ID;Function List ID,Document Groups By Function List,,controller,functionListId,transactionMessage;transactionStatus, : | functionListId,Lists all document groups for a given duty function list.,
doc-groups-by-p-list,controlling.usp_SEL_doc_groups_by_p_list,resultSets,/reading/doc-groups-by-p-list,document-groups/people-list/read,Document Group ID::Document Group Name;People List ID::People List ID,People List ID,Document Groups By People List,,reader,peopleListId,transactionMessage;transactionStatus, : | peopleListId,Lists all the document groups which a given people list has edit permission.  Only lists document groups for which the user has view permission.,
docs-by-contr-doc-grp,controlling.usp_SEL_docs_by_contr_doc_grp,documentData,/reading/docs-by-contr-doc-grp,documents/controller-document-group/read,Document ID::Document ID,,Documents By Controller Document Group,,controller,controllerDocEditGroupNameId;formId,transactionMessage;transactionStatus;numRows;numDocs,Controller Document Group ID: |controllerDocEditGroupNameId,Selects document metadata for a given controller level document group.,TRUE
f-list-by-doc-group,controlling.usp_SEL_f_list_by_doc_group,resultSets,/reading/f-list-by-doc-group,function-list/document-group/read,Function List ID::Function List Name;Doc Group ID::Doc Group ID,Function List ID;Doc Group ID,Function List By Document Group,,controller,docGroupId,transactionMessage;transactionStatus,Document Group ID: | docGroupId,Lists all function lists by document group id. Restricted to only those document groups the user has permission for.,
fgepfl-by-file-group,controlling.usp_SEL_fgepfl_by_file_group,resultSets,/reading/fgepfl-by-file-group,function-list/file-group/file/edit-permission/read,Function List ID::Function List Name;File Group ID::File Group ID,Function List ID;File Group ID,File Group Edit Permission Function List By File Group,,reader,fileGroupId,transactionMessage;transactionStatus, : | fileGroupId,Selects the user function lists which are linked to a file group for file edit permission.,
fgeppl-by-file-group,controlling.usp_SEL_fgeppl_by_file_group,ResultSets,/reading/fgeppl-by-file-group,people-list/file-group/file/edit-permission/read,People List ID::People List Name;File Group ID::File Group ID,People List ID;File Group ID,File Group Edit Permission People List By File Group,Name::ASC,controller,fileGroupId,transactionMessage;transactionStatus, : | fileGroupId,Selects people lists from records of file group to people list edit permission for a given file group.,
file-groups-by-fgepfl,controlling.usp_SEL_file_groups_by_fgepfl,resultSets,/reading/file-groups-by-fgepfl,file-groups/function-list/edit-permission/read,File Group ID::File Group Name;Function List ID::Function List ID,File Group ID;Function List ID,File Groups By File Group Edit Permission Function List,,controller,functionListId,transactionMessage;transactionStatus,: | functionListId,Selects the file groups for which a given function list have edit permission.,
file-groups-by-fgeppl,controlling.usp_SEL_file_groups_by_fgeppl,resultSets,/reading/file-groups-by-fgeppl,file-groups/people-list/edit-permission/read,File Group ID::File Group Name;People List ID::People List ID,File Group ID;People List ID,File Groups By File Group Edit Permission People List,,controller,peopleListId,transactionMessage;transactionStatus,People List: | peopleListId,Selects file groups from records of file group to people list edit permission for a given people list.,
file-grp-ed-prm-f-lsts,controlling.usp_SEL_file_grp_ed_prm_f_lsts,resultSets,/reading/file-grp-ed-prm-f-lsts,file-group/edit-permission/function-list/read,Function List ID::Function List Name;File Group ID::File Group Name,Function List ID;File Group ID,File Group Edit Permission File Lsts,,controller,,transactionMessage;transactionStatus,,Selects all records of file group to user function list via file group edit permission.,
file-grp-ed-prm-p-lsts,controlling.usp_SEL_file_grp_ed_prm_p_lsts,ResultSets,/reading/file-grp-ed-prm-p-lsts,file-groups/edit-permissions/people-lists,People List ID::People List Name;File Group ID::File Group Name,People List ID;File Group ID,File Group Edit Permission People Lsts,,controller,,transactionMessage;transactionStatus,,"Selects all of the records from user_restr.file_group_edit_perm_ppl_lst, i.e the records which link file groups with people lists.",
files-by-contr-file-grp,controlling.usp_SEL_files_by_contr_file_grp,fileData,/reading/files-by-contr-file-grp,files/controller-document-group/read,File ID::Filename,,Files By Controller Document Group,,controller,controllerFileEditGroupNameId;formId,transactionMessage;transactionStatus;numRows;numFiles,Controller Document Group ID: |controllerDocEditGroupNameId,Returns metadata for files for a given controller level file group.,TRUE
p-list-by-doc-group,controlling.usp_SEL_p_list_by_doc_group,ResultSets,/reading/p-list-by-doc-group,people-list/document-group/read,People List ID::People List Name;Doc Group ID::Doc Group ID,People List ID;Doc Group ID,People List By Document Group,Position::ASC,reader,docGroupId,transactionMessage;transactionStatus,Document Group ID: | docGroupId,Lists all of the people lists with edit permission for a given document group. Restricted to only those document groups the user has permission for.,
read-log-by-file-id,controlling.usp_SEL_read_log_by_file_id,data,/reading/read-log-by-file-id,read-log-by-file-id/read,User ID::System Username,User ID,Read Log Records By File ID,,controller,fileId,transactionMessage;transactionStatus;numrows, : | fileId,Selects read log entries for a specific file ID.,
read-log-by-filename,controlling.usp_SEL_read_log_by_filename,data,/reading/read-log-by-filename,read-log-by-filename/read,File ID::Filename;User Id::System Username,User ID,Read Log Records By Filename,,controller,likeString,transactionMessage;transactionStatus;numrows, : | likeString,Selects read log entries by filename pattern.,
read-log-by-sid-id,controlling.usp_SEL_read_log_by_sid_id,data,/reading/read-log-by-sid-id,read-log-by-sid-id/read,User ID::System Username,,Read Log Records By User ID,,controller,userId,transactionMessage;transactionStatus;numrows, : | userId,Selects read log entries for a specific user SID.,
read-log-by-username,controlling.usp_SEL_read_log_by_username,data,/reading/read-log-by-username,read-log-by-username/read,User ID::System Username;File ID::Filename,User ID,Read Log Records By Username,,controller,likeString,transactionMessage;transactionStatus;numrows, : | likeString,Selects read log entries by username pattern.,
read-log-date-between,controlling.usp_SEL_read_log_date_between,data,/reading/read-log-date-between,read-log-date-between/read,File ID::Filename;User Id::System Username,User ID,Read Log Records By Date Between,,controller,earlierDate;laterDate,transactionMessage;transactionStatus;numrows, : | earlierDate;laterDate,Selects read log entries between specified dates.,
users-contains,controlling.usp_SEL_sid_by_username,userData,/reading/users-contains,sid-by-username/read,User ID::System Username,User ID,User Name Contains:,,controller,containsString,transactionMessage;transactionStatus;numRows,| containsString,Lists users where the username contains a given string.,
ed-doc-group-ed-perms,editing.usp_SEL_ed_doc_group_ed_perms,resultSets,/reading/ed-doc-group-ed-perms,document-groups/edit-permission/read,Doc Group ID::Doc Group Name,Doc Group ID,Document Groups Which Connected User Has Edit Permission,,editor,,transactionMessage;transactionStatus,,Selects all document groups for which the connected user has edit permission. Only document groups for which the user has view permission will be listed.,
check-doc-ed-permission,reading.usp_CHECK_doc_ed_permission,,/document/edit-permission/check,document/edit-permission/check,,,,,reader,documentId,transactionMessage;transactionStatus;validationResult,By Document: | documentId,Checks if the connected user has metadata edit permission for a given document id. Returns Pass or Fail.,
check-file-ed-permission,reading.usp_CHECK_file_ed_permission,,/file/edit-permission/check,file/edit-permission/check,,,,,reader,fileId,transactionMessage;transactionStatus;validationResult, : | fileId,Checks if the connected user has metadata edit permission for a given file id. Returns Pass or Fail.,
all-common-obj-lists,reading.usp_SEL_all_common_obj_lists,listsData,/reading/all-common-obj-lists,common-objects/lists/read,Common Object List ID::Common Object List Name;Common Object Attribute ID::Common Object Attribute Name;Common Object ID::Common Object Name,Common Object List ID;Common Object Attribute ID;Common Object ID;List Position,All Common Object Lists,,reader,,transactionMessage;transactionStatus,,Lists all common object lists.,
all-common-objects,reading.usp_SEL_all_common_objects,objectsData,/reading/all-common-objects,common-objects/read,Common Object ID::Common Object Name;Common Object Attribute ID::Common Object Attribute Name;Common Object List ID::Common Object List Name,Common Object ID;Common Object Attribute ID;Common Object List ID,All Common Objects,,reader,,transactionMessage;transactionStatus,,Reads all common object records and associated attribute.,
all-docs-by-fnct-list-name,reading.usp_SEL_all_dc_by_fnct_lst_nm,documentData,/reading/all-docs-by-fnct-list-name,all-documents/function-list-name/read,Document ID::Document ID,,All Documents By Function List Name Field,,reader,generalFieldNameId;formId,transactionMessage;transactionStatus;numberOfRows;numberOfDocs;formName, : | generalFieldNameId;formId,Lists documents for a duty function list related general field name.  No filter group is applied.,TRUE
all-docs-by-funct-fld-name,reading.usp_SEL_all_dc_by_funct_fld_nm,documentData,/reading/all-docs-by-funct-fld-name,all-documents/functional-field-name/read,Document ID::Document ID,,All Documents By Functional Field Name Field,,reader,generalFieldNameId;formId,transactionMessage;transactionStatus;numberOfRows;numberOfDocs;formName, : | generalFieldNameId;formId,Lists documents for a duty function related general field name.  No filter group is applied.,TRUE
all-docs-by-ppl-list-name,reading.usp_SEL_all_dc_by_ppl_lst_nm,documentData,/reading/all-docs-by-ppl-list-name,all-documents/people-list-name/read,Document ID::Document ID,,All Documents By People List Name Field,,reader,generalFieldNameId;formId,transactionMessage;transactionStatus;numberOfRows;numberOfDocs;formName, : | generalFieldNameId;formId,Lists documents for a people list related general field name.  No filter group is applied.,TRUE
all-docs-by-text-field-any,reading.usp_SEL_all_dcs_by_txt_fld_any,documentData,/documents/text-field/any/read,documents/text-field/any/read,Document ID::Document ID,,Any Documents Linked to Given Text Field,,reader,docTextNameId,transactionMessage;transactionStatus;numRows;numdocs, : | docTextNameId,Lists all documents linked to a given text field.,TRUE
all-doc-com-obj-ms-lnk,reading.usp_SEL_all_doc_com_obj_ms_lnk,linksData,/reading/all-doc-com-obj-ms-lnk,common-objects/multi-select/read,Document ID::Document ID;Common Object ID::Common Object Name;Common Object Attribute ID::Common Object Attribute Name;Common Object List ID::Common Object List Name,Common Object ID;Common Object Attribute ID;Common Object List ID;List Position,All Document Common Object Multi-Select Link,,reader,,transactionMessage;transactionStatus,,Lists all document common object muti-select list objects which are linked to any document,
all-doc-com-obj-rb-lnk,reading.usp_SEL_all_doc_com_obj_rb_lnk,linksData,/reading/all-doc-com-obj-rb-lnk,common-objects/radio-button/read,Document ID::Document ID;Common Object ID::Common Object Name;Common Object Attribute ID::Common Object Attribute Name;Common Object List ID::Common Object List Name,Common Object ID;Common Object Attribute ID;Common Object List ID;List Position,All Document Common Object Radio Button Link,,reader,,transactionMessage;transactionStatus,,Lists all document common object radio button list objects which are linked to any document,
all-doc-date-fields,reading.usp_SEL_all_doc_date_fields,dateFieldsData,/reading/all-doc-date-fields,document/date/names/read,Document Date Field Name ID::Date Field Name,Document Date Field Name ID,All Document Date Fields,,reader,,transactionMessage;transactionStatus,,Selects all document date field names.,
all-doc-id-contains,reading.usp_SEL_all_doc_id_contains,documentData,/reading/all-doc-id-contains,document/all-id-contains/read,Document ID::Document ID,,Document ID Contains (unfiltered):,,reader,containsString;formId,transactionMessage;transactionStatus;numDocs;formName ,| containsString,Selects an unfiltered list of documents where the document ID contains a given string.,TRUE
all-doc-int-fields,reading.usp_SEL_all_doc_int_fields,integerFieldsData,/reading/all-doc-int-fields,document/integer-field/read,Document Integer Field Name ID::Document Integer Field Name,Document Integer Field Name ID,All Document Integer Fields,,reader,,transactionMessage;transactionStatus,,Selects all document integer field names.,
all-doc-ms-attributes,reading.usp_SEL_all_doc_ms_attributes,attributesData,/reading/all-doc-ms-attributes,document/multi-select/attributes/read,Doc Multi-Select List ID::Doc Multi-Select List Name;Doc Multi-Select Attribute ID::Doc Multi-Select Attribute Name,Doc Multi-Select List ID;Doc Multi-Select Attribute ID;Name List Position;List Position,All Document Multi-Select Attributes,,reader,,transactionMessage;transactionStatus,,Selects all records of document multi-select list attributes.,
all-doc-ms-lists,reading.usp_SEL_all_doc_ms_lists,listsData,/reading/all-doc-ms-lists,document/multi-select/list/read,Doc Multi-Select List ID::Doc Multi-Select List Name,Doc Multi-Select List ID;List Position,All Document Multi-Select Lists,,reader,,transactionMessage;transactionStatus,,Selects all document multi-select list names.,
all-doc-radiob-attr,reading.usp_SEL_all_doc_radiob_attr,attributesData,/reading/all-doc-radiob-attr,document/radio-button/attribute/read,Doc Radio Button List ID::Doc Radio Button List Name;Doc Radio Button Attribute ID::Doc Radio Button Attribute Name,Doc Radio Button List ID;Doc Radio Button Attribute ID;Attribute List Position;Name List Position,All Document Radio Button Attributes,,reader,,transactionMessage;transactionStatus,,Selects all doc radio button attributes.,
all-doc-radiob-lists,reading.usp_SEL_all_doc_radiob_lists,listsData,/reading/all-doc-radiob-lists,doc-attr/doc-rblist-names/read,Doc Radio Button List ID::Doc Radio Button List Name,Doc Radio Button List ID;List Position,All Document Radio Button Lists,,reader,,transactionMessage;transactionStatus,,,
