TableName,StoredProcedure,DataField,RouteUrl,ApiEndpoint,KeyColumns,HiddenColumns,DisplayName,DefaultSort,Role,InputParameters,OutputParameters,DisplayParameters,Description,UseTransform
files-contains-with-docs,reading.usp_SEL_files_contains,fileData,/reading/files-contains-with-docs,files-contains/read-with-docs,File ID::Filename,,File Content Search by CONTAINS,,reader,containsString;formId,transactionMessage;transactionStatus;numrows;numfiles;formName;filterGroupName,Files containing: | containsString,Selects files where content contains the specified string.  Includes documents data.,TRUE
files-containstable,reading.usp_SEL_files_containstable,fileData,/reading/files-containstable,files-containstable/read,File ID::Filename,,File Content Search by CONTAINSTABLE,,reader,containsString;formId,transactionMessage;transactionStatus;numrows;numfiles;formName;filterGroupName,Files containing: | containsString,Selects files where content contains the specified string (table version).,TRUE
files-containstable-with-docs,reading.usp_SEL_files_containstable,fileData,/reading/files-containstable-with-docs,files-containstable/read-with-docs,File ID::Filename,,File Content Search by CONTAINSTABLE,,reader,containsString;formId,transactionMessage;transactionStatus;numrows;numfiles;formName;filterGroupName,Files containing: | containsString,Selects files where content contains the specified string (table version).  Includes documents data.,TRUE
files-date-after,reading.usp_SEL_files_date_after,fileData,/reading/files-date-after,files/date/after/read,File ID::Filename,,Files Date After,,reader,fileDateNameId;dateValue;filterGroupId;formId,transactionMessage;transactionStatus;numRows;numFiles, : | fileDateNameId;dateValue;filterGroupId;formId,Returns metadata for files where a date record is after a given date.,TRUE
files-date-before,reading.usp_SEL_files_date_before,fileData,/reading/files-date-before,files/date/before/read,File ID::Filename,,Files Date Before,,reader,fileDateNameId;dateValue;filterGroupId;formId,transactionMessage;transactionStatus;numRows;numFiles, : | fileDateNameId;dateValue;filterGroupId;formId,Returns metadata for files where a date record is before a given date.  A filter group is applied.,TRUE
files-date-between,reading.usp_SEL_files_date_between,fileData,/reading/files-date-between,files/date/between/read,File ID::Filename,,Files Date Between,,reader,fileDateNameId;earlierDate;laterDate;filterGroupId;formId,transactionMessage;transactionStatus;numRows;numFiles, : | fileDateNameId;earlierDate;laterDate;filterGroupId;formId,Returns metadata for files where a date record is between given dates.,TRUE
files-date-equals,reading.usp_SEL_files_date_equals,fileData,/reading/files-date-equals,files/date/equals/read,File ID::Filename,,Files Date Equals,,reader,fileDateNameId;dateValue;filterGroupId;formId,transactionMessage;transactionStatus;numRows;numFiles, : | fileDateNameId;dateValue;filterGroupId;formId,Returns metadata for files where a date record is equal to a given date.,TRUE
files-for-one-document,reading.usp_SEL_files_for_one_document,fileData,/reading/files-for-one-document,files/document/read,File ID::Filename,,This is a filtered list of files. ,,reader,documentId;filterGroupId;formId,transactionMessage;transactionStatus;numRows;numFiles,By Document: | documentId,Retrieves file IDs and data which are linked to the given document ID and filtered by filter group.,TRUE
files-freetext,reading.usp_SEL_files_freetext,fileData,/reading/files-freetext,files-freetext/read,File ID::Filename,,File Content Search by FREETEXT:,,reader,containsString;filterGroupId;formId,transactionMessage;transactionStatus;numrows;numfiles;formName;filterGroupName,| containsString,Selects files using freetext search on content.,TRUE
files-freetext-with-docs,reading.usp_SEL_files_freetext,fileData,/reading/files-freetext-with-docs,files-freetext/read-with-docs,File ID::Filename,,File Content Search by FREETEXT:,,reader,containsString;filterGroupId;formId,transactionMessage;transactionStatus;numrows;numfiles;formName;filterGroupName,| containsString,Selects files using freetext search on content.    Includes document data.,TRUE
files-freetexttable,reading.usp_SEL_files_freetexttable,fileData,/reading/files-freetexttable,files-freetexttable/read,File ID::Filename,,File Content Search by FREETEXTTABLE:,,reader,containsString;filterGroupId;formId,transactionMessage;transactionStatus;numrows;numfiles;formName;filterGroupName,| containsString,Selects files using freetext search on content (table version).,TRUE
files-freetexttable-with-docs,reading.usp_SEL_files_freetexttable,fileData,/reading/files-freetexttable-with-docs,files-freetexttable/read-with-docs,File ID::Filename,,File Content Search by FREETEXTTABLE:,,reader,containsString;filterGroupId;formId,transactionMessage;transactionStatus;numrows;numfiles;formName;filterGroupName,| containsString,Selects files using freetext search on content (table version).    Includes document data.,TRUE
files-int-between,reading.usp_SEL_files_int_between,fileData,/reading/files-int-between,files/integer/between/read,File ID::Filename,,Files Integer Between,,reader,fileIntNameId;lowerIntValue;upperIntValue;filterGroupId;formId,transactionMessage;transactionStatus;numRows;numFiles, : | fileIntNameId;lowerIntValue;upperIntValue;filterGroupId;formId,Selects file IDs and metadata where an integer field is between given integer values.  A filter group is applied.,TRUE
files-int-equals,reading.usp_SEL_files_int_equals,fileData,/reading/files-int-equals,files/integer/equals/read,File ID::Filename,,Files Integer Equals,,reader,fileIntNameId;integerValue;filterGroupId;formId,transactionMessage;transactionStatus;numRows;numFiles, : | fileIntNameId;integerValue;filterGroupId;formId,Selects file IDs and metadata according to a given integer value.  A filter group is applied.,TRUE
files-int-greater-than,reading.usp_SEL_files_int_greater_than,fileData,/reading/files-int-greater-than,files/integer/greater-than/read,File ID::Filename,,Files Integer Greater Than,,reader,fileIntNameId;integerValue;filterGroupId;formId,transactionMessage;transactionStatus;numRows;numFiles, : | fileIntNameId;integerValue;filterGroupId;formId,Selects file IDs and metadata where the date for a given integer field greater than a given integer value. A filter gruopo is applied.,TRUE
files-int-less-than,reading.usp_SEL_files_int_less_than,fileData,/reading/files-int-less-than,files/integer/less-than/read,File ID::Filename,,Files Integer Less Than,,reader,fileIntNameId;integerValue;filterGroupId;formId,transactionMessage;transactionStatus;numRows;numFiles, : | fileIntNameId;integerValue;filterGroupId;formId,Selects file IDs and metadata where an integer field is less than a given integer value.  A filter group is applied.,TRUE
files-real-between,reading.usp_SEL_files_real_between,fileData,/reading/files-real-between,files/real/between/read,File ID::Filename,,Files Real Between,,reader,fileRealNumberFieldNameId;lowerRealValue;upperRealValue;filterGroupId;formId,transactionMessage;transactionStatus;numRows;numFiles, : | fileRealNumberFieldNameId;lowerRealValue;upperRealValue;filterGroupId;formId,Selects file IDs and metadata according where a real number between two given values. A filter group is applied.,TRUE
files-real-equals,reading.usp_SEL_files_real_equals,fileData,/reading/files-real-equals,files/real/equals/read,File ID::Filename,,Files Real Equals,,reader,fileRealNumberFieldNameId;realNumberValue;filterGroupId;formId,transactionMessage;transactionStatus;numRows;numFiles, : | fileRealNumberFieldNameId;realNumberValue;filterGroupId;formId,Selects file IDs and metadata according to a given real number value.  A filter group is applied.,TRUE
files-real-greater,reading.usp_SEL_files_real_greater,fileData,/reading/files-real-greater,files/real/greater/read,File ID::Filename,,Files Real Greater,,reader,fileRealNumberFieldNameId;realNumberValue;filterGroupId;formId,transactionMessage;transactionStatus;numRows;numFiles, : | fileRealNumberFieldNameId;realNumberValue;filterGroupId;formId,Selects file IDs and metadata according where a real number of greater than a given value.  A filter group is applied.,TRUE
files-real-less-than,reading.usp_SEL_files_real_less_than,fileData,/reading/files-real-less-than,files/real/less-than/read,File ID::Filename,,Files Real Less Than,,reader,fileRealNumberFieldNameId;realNumberValue;filterGroupId;formId,transactionMessage;transactionStatus;numRows;numFiles, : | fileRealNumberFieldNameId;realNumberValue;filterGroupId;formId,Selects file IDs and metadata according where a real number of less than a given value.  A filter group is applied.,TRUE
filter-group,reading.usp_SEL_filter_group,resultSets,/reading/filter-group,filter-group/read,Filter Group ID::Filter Group Name,Filter Group ID;List Position,Filter Group,,reader,filterGroupId,transactionMessage;transactionStatus,| filterGroupId,Selects one filter group by filter group id.,
files-by-fnct-list-name,reading.usp_SEL_fl_by_fnct_list_name,fileData,/reading/files-by-fnct-list-name,files/function-list-name/read,File ID::Filename,,Files By Function List Name Field,,reader,generalFieldNameId;filterGroupId;formId,transactionMessage;transactionStatus;numberOfRows;numberOfRecords;numberOfDocs;formName;filterGroupName,,Lists files for a duty function list related general field name.  A filter group is applied.,TRUE
files-by-people-list-field-name,reading.usp_SEL_fl_by_ppl_list_name,fileData,/reading/files-by-people-list-field-name,files/people-list-name/read,File ID::Filename,,Files By People List Name Field,,reader,generalFieldNameId;filterGroupId;formId,transactionMessage;transactionStatus;numberOfRows;numberOfRecords;numberOfDocs;formName;filterGroupName,,Lists files for a people list related general field name.  A filter group is applied.,TRUE
fl-cm-obj-ms-lnk-by-fl,reading.usp_SEL_fl_cm_obj_ms_lnk_by_fl,resultSets,/reading/fl-cm-obj-ms-lnk-by-fl,file/common-object/multi-select/link/file/read,Common Object List ID::Common Object List Name;Common Object ID::Common Object Name;Common Object Attribute ID::Common Object Attribute Name;File ID::File ID,Common Object List ID;Common Object ID;Common Object Attribute ID;List Position;File ID,File Common Object Multi-Select Link By File,,reader,fileId,transactionMessage;transactionStatus, : | fileId,Lists all file common object multi-select list objects for a given file.,
fl-cm-obj-rb-lnk-by-fl,reading.usp_SEL_fl_cm_obj_rb_lnk_by_fl,resultSets,/reading/fl-cm-obj-rb-lnk-by-fl,file/common-object/radio-button/link/file/read,Common Object List ID::Common Object List Name;Common Object ID::Common Object Name;Common Object Attribute ID::Common Object Attribute Name;File ID::File ID,Common Object List ID;Common Object ID;Common Object Attribute ID;List Position;File ID,File Common Object Radio Button Link By File,,reader,fileId,transactionMessage;transactionStatus, : | fileId,Lists all file common object radio button objects for a given file.,
fnct-lists-by-function,reading.usp_SEL_fnct_lists_by_function,resultSets,/reading/fnct-lists-by-function,function-list/function/read,Function List ID::Function List Name;Duty Function ID::Duty Function ID,Function List ID;Duty Function ID;Function List Position,Function Lists By Function,,reader,functionId,transactionMessage;transactionStatus,: |functionId,Lists all of the function lists for a given duty function form the function lists table.,
function-lists-for-connected-user,reading.usp_SEL_fnct_lists_for_user,resultSets,/reading/function-lists-for-connected-user,function-lists-for-user/read,Function List ID::Function List Name;Duty Function ID::Duty Function Name,Function List ID;Duty Function ID;Function List Position,All Function Lists,,reader,,transactionMessage;transactionStatus,,Lists all duty function lists which the connected user is linked to.,
form-group,reading.usp_SEL_form_group,resultSets,/reading/form-group,form-group/read,Form Group ID::Form Group Name,Form Group ID;List Position,Form Group,,reader,formGroupId,transactionMessage;transactionStatus,| formGroupId,Selects one form group by form group id.,
form-name,reading.usp_SEL_form_name,resultSets,/reading/form-name,form/name/read,Form ID::Form Name;Form Group ID::Form Group Name,Form ID;List Position;Form Group ID,Form Name,,reader,formId,transactionMessage;transactionStatus,| formId,Select a form name.,
forms-by-form-group,reading.usp_SEL_forms_by_form_group,resultSets,/forms/by-form-group,forms/form-group/read,Form ID::Form Name;Form Group ID::Form Group ID,Form ID;Form Group ID;List Position,Forms by Form Group,,reader,formGroupId,transactionMessage;transactionStatus;numberOfRows, : | formGroupId,Lists all forms for a given form group ID.,
function-lists-by-doc,reading.usp_SEL_function_lists_by_doc,resultSets,/reading/function-lists-by-doc,function-list/document/read,Function List ID::Function List Name;General Field Name ID::General Field Name;Document ID::Document ID,Function List ID;General Field Name ID;Document ID,Function Lists By Document,,reader,documentId,transactionMessage;transactionStatus,By Document: | documentId,Lists all of the functions linked to a given document ID.,
function-lists-by-file,reading.usp_SEL_function_lists_by_file,resultSets,/reading/function-lists-by-file,function-list/file/read,Function List ID::Function List Name;General Field Name ID::General Field Name;File ID::File ID,Function List ID;General Field Name ID;File ID,Function Lists By File,,reader,fileId,transactionMessage;transactionStatus, : | fileId,Lists all of the function lists linked to a given file ID.,
functions-by-doc,reading.usp_SEL_functions_by_doc,resultSets,/reading/functions-by-doc,duty-function/document/read,Duty Function ID::Duty Function Name;General Field Name ID::General Field Name;Document ID::Document ID,Duty Function ID;List Position;General Field Name ID;Document ID,Functions By Document,,reader,documentId,transactionMessage;transactionStatus,By Document: | documentId,Lists all of the functions linked to a given document ID.,TRUE
functions-by-file,reading.usp_SEL_functions_by_file,resultSets,/reading/functions-by-file,duty-function/file/read,Duty Function ID::Duty Function Name;General Field Name ID::General Field Name;File ID::File ID,Duty Function ID;List Position;General Field Name ID;File ID,Functions By File,,reader,fileId,transactionMessage;transactionStatus,By File: | fileId,Lists all of the functions linked to a given file ID.,
functions-by-fnct-list,reading.usp_SEL_functions_by_fnct_list,resultSets,/reading/functions-by-fnct-list,duty-function/function-list/read,Duty Function ID::Duty Function Name;Function List ID::Function List ID,Duty Function ID;List Position;Function List ID,Functions By Function List,,reader,functionListId,transactionMessage;transactionStatus,Function List: | functionListId,Lists all duty functions for a given function list from the function lists table.,
general-field-names,reading.usp_SEL_general_field_names,resultSets,/reading/general-field-names,general-field-names/read,General Field Name ID::General Field Name,General Field Name ID,General Field Names,,reader,,transactionMessage;transactionStatus,,Lists all general field names.,
all-global-settings,reading.usp_SEL_global_settings,resultSets,/reading/all-global-settings,global-settings/read,,,Global Settings,,reader,,transactionMessage;transactionStatus,,Lists all global settings.,
read-individual-browsing-trees,reading.usp_SEL_indiv_browsing_trees,individualBrowsingTreesData,/reading/indiv-browsing-trees,individual-browsing-trees/read,Tag Browsing Tree ID::Tag Browsing Tree Name,Tag Browsing Tree ID,Personal Browsing Trees,,reader,,transactionMessage;transactionStatus,,Lists browsing trees owned by the connected users,
nameplate,reading.usp_SEL_nameplate,nameplateData,/reading/nameplate,nameplate/read,,,Elyse Database Layer Product Nameplate,,reader,,transactionMessage;transactionStatus,,Retrieves product nameplate data.,
welcome,reading.usp_SEL_nameplate,nameplateData,/,nameplate/read,,,Welcome to Elyse,,reader,,transactionMessage;transactionStatus,,Retrieves product nameplate data.,
non-pers-pple-lst-nms,reading.usp_SEL_non_pers_pple_lst_nms,data,/reading/non-pers-pple-lst-nms,non-pers-pple-lst-nms/read,People List ID::People List Name,People List ID;Mnemonic;List Position,People List Names Excluding Personal Lists,,reader,,transactionMessage;transactionStatus,,Selects non-personal people list names.,
number-of-all-docs,reading.usp_SEL_number_of_all_docs,,/reading/number-of-all-docs,document/number-of-all-docs,,,Number Of All Documents,,reader,,numberOfDocs,,,
number-of-all-files,reading.usp_SEL_number_of_all_files,,/reading/number-of-all-files,file/number-of-all-files,,,Number Of All Files,,reader,,numberOfFiles,,,
one-doc-all-data,reading.usp_SEL_one_doc_all_data,documentData,/reading/one-doc-all-data,document/all-data/read,Document ID::Document ID;File ID::FileID,,One Document All Data,,reader,documentId;formId,transactionMessage;transactionStatus;numRecords;formName,Document ID: | documentId,Retrieves all the data for a document and all associated files according to a form ID.,TRUE
one-document-data,reading.usp_SEL_one_document_data,documentData,/reading/one-document-data,document/one-document-data,Document ID::Document ID;File ID::FileID,,One Document Data,,reader,documentId;filterGroupId;formId,transactionMessage;transactionStatus;numRecords;formName;filterGroupName,By Document: | documentId,Lists document metdata and also the file metadata of the key file linked to the document id,TRUE
sel-one-file-data,reading.usp_SEL_one_file_data,fileData,/reading/select-one-file-data,select-one-file-data/read,File ID::Filename,,File Data,,reader,fileId;formId,transactionMessage;transactionStatus;numrows;formName, : | fileId;formId,Selects data for one file.,TRUE
people-lists-by-doc,reading.usp_SEL_people_lists_by_doc,ResultSets,/reading/people-lists-by-doc,people-list/document/read,People List ID::People List Name;General Field Name ID::General Field Name;Document ID::Document ID,People List ID;List Position;People List ID;General Field Name ID;Document ID,People Lists By Document,,reader,documentId,transactionMessage;transactionStatus,By Document: | documentId,Lists all of the people lists linked to a given document ID.,
people-lists-by-file,reading.usp_SEL_people_lists_by_file,ResultSets,/reading/people-lists-by-file,people-list/file/read,People List ID::People List Name;General Field Name ID::General Field Name;File ID::File ID,People List ID;List Position;People List ID;General Field Name ID;File ID,People Lists By File,,reader,fileId,transactionMessage;transactionStatus, : | fileId,Lists all of the people lists linked to a given file ID.,
people-lists-by-person,reading.usp_SEL_people_lists_by_person,ResultSets,/reading/people-lists-by-person,people-list/person/read,People List ID::People List Name;User ID::User ID,People List ID;List Position;User ID,People Lists By Person,,reader,personId,transactionMessage;transactionStatus, : | personId,Lists all the person lists for a given individual.,
people-lists-for-connected-user,reading.usp_SEL_people_lists_for_user,ResultSets,/reading/people-lists-for-user,people-list/user/read,People List ID::People List Name,People List ID;List Position,People Lists For Connected User,,reader,,transactionMessage;transactionStatus,,Lists all the person lists for the connected user.,
persons-by-people-list,reading.usp_SEL_persons_by_people_list,ResultSets,/reading/persons-by-people-list,user/people-list/read,User ID::System Username;People List ID::People List ID,User ID;Person List Position;People List ID,Persons By People List,,reader,peopleListId,transactionMessage;transactionStatus, : | peopleListId,Lists all the individuals for a given people list.,
read-privileges,reading.usp_SEL_privileges,privilegesData,/reading/privileges,privileges/read,,Privilege ID;Granted On;Granted By,Privileges for Connected User,,reader,,transactionMessage;transactionStatus,,Lists privileges for the connected user.,
rstr-doc-group-names-exunrstr,reading.usp_SEL_restr_doc_group_names,restrictedDocGroupNames,/reading/restricted-doc-group-names,restricted-document-group-names/read,Doc Group ID::Doc Group Name,Doc Group ID,Document Group Names Restricted,,reader,,transactionMessage;transactionStatus,,"Selects document groups which the connected user has rights to, except those which have no restrictions ",
sids-by-duty-function,reading.usp_SEL_sids_by_duty_function,ResultSets,/reading/sids-by-duty-function,sid/duty-function/read,User ID::System Username;Duty Function ID::Duty Function ID,User ID;Duty Function ID,Users By Duty Function,SID Record ID::DESC,reader,functionId,transactionMessage;transactionStatus, : | functionId,Lists the sid records for a given duty function from the duty function to sid links table.,
tag-br-tr-perm-flists,reading.usp_SEL_tag_br_tr_perm_flists,ResultSets,/reading/tag-br-tr-perm-flists,tag/browsing-tree/permission/function-list/read,Tag Browsing Tree ID::Tag Browsing Tree Name;Function List ID::Function List Name,Tag Browsing Tree ID;Function List ID,Tag Browsing Tree Permission Function Lists,,reader,,transactionMessage;transactionStatus,,Selects all the records which authorise members of a function list to link to a tag browsing tree.,
tag-br-tr-perm-plists,reading.usp_SEL_tag_br_tr_perm_plists,ResultSets,/reading/tag-br-tr-perm-plists,tag/browsing-tree/permission/people-list/read,Tag Browsing Tree ID::Tag Browsing Tree Name;People List ID::People List Name,Tag Browsing Tree ID;People List ID,Tag Browsing Tree Permission Plists,,reader,,transactionMessage;transactionStatus,,Selects all the records which authorise members of a people list to link to a tag browsing tree.,
tag-by-tag-id,reading.usp_SEL_tag_by_tag_id,ResultSets,/reading/tag-by-tag-id,tag/tag/read,Tag ID::Tag Name,Tag ID,Tag By Tag ID,,reader,tagId,transactionMessage;transactionStatus, : | tagId,Selects the details for a given tag ID.,
tag-get-ancestors,reading.usp_SEL_tag_get_ancestors,ResultSets,/reading/tag-get-ancestors,tag/ancestors/read,Tag ID::Tag Name;Tag Tree Node ID::Tag Tree Node ID;Tag Tree Node ID::Tag Tree Node ID,Tag ID;Tag Tree Node ID,Tag Get Ancestors,,reader,tagTreeNodeId,transactionMessage;transactionStatus, : | tagTreeNodeId,Selects all of the ancestors of a tag tree node.,
tag-get-descendants,reading.usp_SEL_tag_get_descendants,ResultSets,/reading/tag-get-descendants,tag/descendants/read,Tag ID::Tag Name;Tag Tree Node ID::Tag Tree Node ID;Tag Tree Node ID::Tag Tree Node ID,Tag ID;Tag Tree Node ID,Tag Get Descendants,,reader,tagTreeNodeId,transactionMessage;transactionStatus, : | tagTreeNodeId,Selects all of the descendants of a tag tree node.,
tag-get-root,reading.usp_SEL_tag_get_root,ResultSets,/reading/tag-get-root,tag/root/read,Tag ID::Tag Name;Tag Tree Node ID::Tag Tree Node ID;Tag Tree Node ID::Tag Tree Node ID,Tag ID;Tag Tree Node ID,Tag Get Root,,reader,tagTreeNodeId,transactionMessage;transactionStatus, : | tagTreeNodeId,Selects the root node of the tree for a given node.,
tag-group-perm-flists,reading.usp_SEL_tag_group_perm_flists,resultSets,/reading/tag-group-perm-flists,user/tag-group/permission/function-list/read,Tag Group ID::Tag Group Name;Function List ID::Function List Name,Tag Group ID;Function List ID,Tag Group Permission Function Lists,,reader,,transactionMessage;transactionStatus,,Selects all the records which authorise members of a function list to link tags to a tag group.,
tag-group-perm-plists,reading.usp_SEL_tag_group_perm_plists,ResultSets,/reading/tag-group-perm-plists,user/tag-group/permission/people-list/read,Tag Group ID::Tag Group Name;People List ID::People List Name,Tag Group ID;People List ID,Tag Group Permission Plists,,reader,,transactionMessage;transactionStatus,,Selects all the records which authorise members of a people list to link tags to a tag group.,
tag-groups-by-tag,reading.usp_SEL_tag_groups_by_tag,ResultSets,/reading/tag-groups-by-tag,tag-group/tag/read,Tag Group ID::Tag Group Name;Tag ID::Tag ID,Tag Group ID;List Position;Tag ID,Tag Groups By Tag,,reader,tagId,transactionMessage;transactionStatus, : | tagId,Selects the data for all of the tag groups linked to a given tag.,
tag-groups-with-ed-perm,reading.usp_SEL_tag_groups_with_ed_perm,ResultSets,/reading/tag-groups-with-ed-perm,user/tag-group/edit-permission/read,Tag Group ID::Tag Group Name,Tag Group ID;List Position,Tag Groups With Edit Permission,,reader,,transactionMessage;transactionStatus,,Lists all tag groups which the connected user has permission to link tags to.,
tag-tree-by-tree-id,reading.usp_SEL_tag_tree_by_tree_id,resultSets,/reading/tag-tree-by-tree-id,tag-tree/tag-tree/read,Tag ID::Tag Name;Tag Tree Node ID::Tag Tree Node ID;Tag Tree ID::Tag Tree ID,Tag ID;Tag Tree ID,Tag Relationship Tree By Tree ID: ,,reader,tagTreeId,transactionMessage;transactionStatus,| tagTreeId,Selects all of the tags for a given tag tree ID.,
tag-tree-perm-flists,reading.usp_SEL_tag_tree_perm_flists,ResultSets,/reading/tag-tree-perm-flists,tag-tree/permission/function-list/read,Tag Tree ID::Tag Tree Name;Function List ID::Function List Name,Tag Tree ID;Function List ID,Tag Relationship Tree Permission Function Lists,,reader,,transactionMessage;transactionStatus,,Selects all the records which authorise members of a function list to link to a tag tree.,
tag-tree-perm-plists,reading.usp_SEL_tag_tree_perm_plists,resultSets,/reading/tag-tree-perm-plists,tag-tree/permission/people-list/read,Tag Tree ID::Tag Tree Name;People List ID::People List Name,Tag Tree ID;People List ID,Tag Relationship Tree Permission People Lists,,reader,,transactionMessage;transactionStatus,,Selects all the records which authorise members of a people list to link to a tag tree.,
