TableName,StoredProcedure,DataField,RouteUrl,ApiEndpoint,KeyColumns,HiddenColumns,DisplayName,DefaultSort,Role,InputParameters,OutputParameters,DisplayParameters,Description,UseTransform
all-files-int-between,reading.usp_SEL_all_files_int_between,fileData,/reading/all-files-int-between,file/integer/between/read,File ID::Filename,,All Files Integer Between,,reader,fileIntNameId;lowerIntValue;upperIntValue;formId,transactionMessage;transactionStatus;numRows;numFiles, : | fileIntNameId;lowerIntValue;upperIntValue;formId,Selects file IDs and metadata where the value for a given integer field is between two given integer values.  No filter group is applied.,TRUE
all-files-int-equals,reading.usp_SEL_all_files_int_equals,fileData,/reading/all-files-int-equals,file/integer/equals/read,File ID::Filename,,All Files Integer Equals,,reader,fileIntNameId;integerValue;formId,transactionMessage;transactionStatus;numRows;numFiles, : | fileIntNameId;integerValue;formId,Selects file IDs and metadata where a given integer field equals a given integer value.  No filter group is applied.,TRUE
all-files-int-grtr-than,reading.usp_SEL_all_files_int_grtr_than,fileData,/reading/all-files-int-grtr-than,file/integer/greater-than/read,File ID::Filename,,All Files Integer Grtr Than,,reader,fileIntNameId;integerValue;formId,transactionMessage;transactionStatus;numRows;numFiles, : | fileIntNameId;integerValue;formId,Selects file IDs and metadata where a given integer field is greater than a given integer value.  No filter group is applied.,TRUE
all-files-int-less-than,reading.usp_SEL_all_files_int_less_than,fileData,/reading/all-files-int-less-than,file/integer/less-than/read,File ID::Filename,,All Files Integer Less Than,,reader,fileIntNameId;integerValue;formId,transactionMessage;transactionStatus;numRows;numFiles, : | fileIntNameId;integerValue;formId,Selects file IDs and metadata where a given integer field is less than a given integer value.  No filter group is applied.,TRUE
all-files-real-any,reading.usp_SEL_all_files_real_any,fileData,/files/real/any/read,files/real/any/read,File ID::Filename,,Any Files Linked to Given Real Number Field,,reader,fileRealNumberFieldNameId,transactionMessage;transactionStatus;numRows;numFiles, : | fileRealNumberFieldNameId,Lists all files linked to a given real number field.,TRUE
all-files-real-between,reading.usp_SEL_all_files_real_between,fileData,/reading/all-files-real-between,file/real/between/read,File ID::Filename,,All Files Real Between,,reader,fileRealNumberFieldNameId;lowerRealValue;upperRealValue;formId,transactionMessage;transactionStatus;numRows;numFiles, : | fileRealNumberFieldNameId;lowerRealValue;upperRealValue;formId,Selects file IDs and metadata where the value for a given real number field is between two given values. No filter group is applied.,TRUE
all-files-real-equals,reading.usp_SEL_all_files_real_equals,fileData,/reading/all-files-real-equals,file/real/equals/read,File ID::Filename,,All Files Real Equals,,reader,fileRealNumberFieldNameId;realNumberValue;formId,transactionMessage;transactionStatus;numRows;numFiles, : | fileRealNumberFieldNameId;realNumberValue;formId,Selects file IDs and metadata where the value for a given real number field equals a given value. No filter group is applied.,TRUE
all-files-real-greater,reading.usp_SEL_all_files_real_greater,fileData,/reading/all-files-real-greater,file/real/greater/read,File ID::Filename,,All Files Real Greater,,reader,fileRealNumberFieldNameId;realNumberValue;formId,transactionMessage;transactionStatus;numRows;numFiles, : | fileRealNumberFieldNameId;realNumberValue;formId,Selects file IDs and metadata where the value for a given real number field is greater than a given value.  No filter group is applied.,TRUE
all-files-real-less,reading.usp_SEL_all_files_real_less,fileData,/reading/all-files-real-less,file/real/less-than/read,File ID::Filename,,All Files Real Less,,reader,fileRealNumberFieldNameId;realNumberValue;formId,transactionMessage;transactionStatus;numRows;numFiles, : | fileRealNumberFieldNameId;realNumberValue;formId,Selects file IDs and metadata according to where a real number of less than a given value.  Applies a filter group.,TRUE
all-files-with-ed-perm,reading.usp_SEL_all_files_with_ed_perm,fileData,/reading/all-files-with-ed-perm,file/edit-permission/read,File ID::Filename,,All Files With Edit Permission,,reader,formId,transactionMessage;transactionStatus;numRows;numFiles,| formId,Lists the metadata for all of the files that the connected user has edit permission.,TRUE
all-filter-group-attr,reading.usp_SEL_all_filter_group_attr,filterGroupAttributes,/reading/all-filter-group-attr,filter-group/attribute/read,Field Name ID::Field Name;Attribute ID::Attribute Value,Field Name ID;Attribute ID,Filter Group Attributes,,reader,filterGroupId,transactionMessage;transactionStatus;numRows;filterGroupName,:| filterGroupId,Selects all the attributes linked to a given filter group id.,
all-filter-groups,reading.usp_SEL_all_filter_groups,groupsData,/reading/all-filter-groups,filter-group/all/read,Filter Group ID::Filter Group Name,Filter Group ID;List Position,All Filter Groups,,reader,,transactionMessage;transactionStatus,,Selects all filter groups,
all-files-by-fnct-list-name,reading.usp_SEL_all_fl_by_fnct_lst_nm,fileData,/reading/all-files-by-fnct-list-name,all-files/function-list-name/read,File ID::Filename,,All Files By Function List Name Field,,reader,generalFieldNameId;formId,transactionMessage;transactionStatus;numberOfRows;numberOfDocs;formName,,Lists files for a duty function list related general field name.  No filter group is applied.,TRUE
all-files-by-funct-fld-name,reading.usp_SEL_all_fl_by_funct_fld_nm,fileData,/reading/all-files-by-funct-fld-name,all-files/functional-field-name/read,File ID::Filename,,All Files By Functional Field Name Field,,reader,generalFieldNameId;formId,transactionMessage;transactionStatus;numberOfRows;numberOfDocs;formName,,Lists files for a duty function related general field name.  No filter group is applied.,TRUE
all-files-by-pple-list-field-name,reading.usp_SEL_all_fl_by_ppl_lst_nm,fileData,/reading/all-files-by-people-list-field-name,all-files/people-list-name/read,File ID::Filename,,All Files By People List Name Field,,reader,generalFieldNameId;formId,transactionMessage;transactionStatus;numberOfRows;numberOfDocs;formName,,Lists files for a people list related general field name.  No filter group is applied.,TRUE
all-fl-cm-obj-ms-lnk,reading.usp_SEL_all_fl_cm_obj_ms_lnk,fileCommonObjectMultiSelectLists,/reading/all-fl-cm-obj-ms-lnk,file/common-object/multi-select/object/read,File ID::File ID;Common Object ID::Common Object Name;Common Object Attribute ID::Common Object Attribute Name;Common Object ListID::Common Object List Name,Common Object ID;Common Object Attribute ID;Common Object List ID;List Position,All File Common Object Multi-Select Link,,reader,,transactionMessage;transactionStatus,,Lists all file common object multi-select list objects.,
all-fl-cm-obj-rb-lnk,reading.usp_SEL_all_fl_cm_obj_rb_lnk,fileCommonObjectRadioButtonLinks,/reading/all-fl-cm-obj-rb-lnk,file/common-object/radio-button/object/read,File ID::File ID;Common Object ID::Common Object Name;Common Object Attribute ID::Common Object Attribute Name;Common Object ListID::Common Object List Name,Common Object ID;Common Object Attribute ID;Common Object List ID;List Position,All File Common Object Radio Button Link,,reader,,transactionMessage;transactionStatus,,Lists all file common object radio button objects.,
all-fls-by-co-ms-attr,reading.usp_SEL_all_fls_by_co_ms_attr,fileData,/reading/all-fls-by-co-ms-attr,file/common-object/multi-select/read,File ID::Filename,,All Fls By Common Object Multi-Select Attribute,,reader,commonObjectListId;commonObjectId;formId,transactionMessage;transactionStatus;numRows;numFiles,Common Object Attribute ID: | commonObjectId,Lists all the metadata for files for a given common object multi-select attribute.,TRUE
all-fls-by-co-rb-attr,reading.usp_SEL_all_fls_by_co_rb_attr,fileData,/reading/all-fls-by-co-rb-attr,file/common-object/radio-button/read,File ID::Filename,,All Fls By Common Object Radio Button Attribute,,reader,commonObjectListId;commonObjectId;formId,transactionMessage;transactionStatus;numRows;numFiles,Common Object Attribute ID: | commonObjectId,Lists all the metadata for files for a given common object radio button attribute.,TRUE
all-files-by-text-field-any,reading.usp_SEL_all_fls_by_txt_fld_any,fileData,/files/text-field/any/read,files/text-field/any/read,File ID::Filename,,Any Files Linked to Given Text Field,,reader,fileTextNameId,transactionMessage;transactionStatus;numRows;numFiles, : | fileTextNameId,Lists all files linked to a givne text field,TRUE
all-form-defaults,reading.usp_SEL_all_form_defaults,formDefaults,/reading/all-form-defaults,form/default/read,Form ID::Form ID,Field Name ID;Attribute ID;Form ID,All Form Defaults,,reader,formId,transactionMessage;transactionStatus;numRows,| formId,Returns all of the defaults for a given form.,
all-form-fields,reading.usp_SEL_all_form_fields,formFieldsData,/reading/all-form-fields,forms/all-form-fields,Form ID::Form ID,Field Name ID;Attribute ID;Form ID,All Form Fields:,,reader,formId,transactionMessage;transactionStatus;numberOfRows;formName,| formId,Lists all of the elements of a form.,
all-form-groups,reading.usp_SEL_all_form_groups,groupsData,/reading/form/groups,form/groups/read,Form Group ID::Form Group Name,Form Group ID;List Position,All Form Groups,,reader,,transactionMessage;transactionStatus,,Selects all form groups.,
all-form-names,reading.usp_SEL_all_form_names,resultSets,/reading/all-form-names,form/name/all/read,Form ID::Form Name;Form Group ID::Form Group Name,Form ID;List Position;Form Group ID,All Form Names,,reader,,transactionMessage;transactionStatus;numRows,,Select all form names.,
all-function-lists,reading.usp_SEL_all_function_lists,resultSets,/reading/all-function-lists,duty-function/read,Function List ID::Function List Name;Duty Function ID::Duty Function Name,Function List ID;Duty Function ID;Function List Position,All Function Lists,,reader,,transactionMessage;transactionStatus,,Lists all duty function list records.,
all-function-lst-names,reading.usp_SEL_all_function_lst_names,dropDownOptions,/reading/all-function-lst-names,function-list-names/read-all,Function List ID::Function List Name,Function List ID;List Position,All Function List Names,,reader,,transactionMessage;transactionStatus,,Lists all duty function list name records.,
recent-documents,reading.usp_SEL_all_recent_documents,documentData,/reading/recent-documents,recent-documents/read,Document ID::Document ID,DCBSIDID,Recently Created Documents,,reader,minutes;formId,transactionMessage;transactionStatus;numberOfDocs;formName,,Selects all documents created or modified within the specified number of minutes.,TRUE
recent-files,reading.usp_SEL_all_recent_files,fileData,/reading/recent-files,recent-files/read,File ID::Filename,,Recently Created Files,,reader,minutes;formId,transactionMessage;transactionStatus;numberOfFiles;formName,,Selects all files created or modified within the specified number of minutes.,TRUE
all-tag-group-id-names,reading.usp_SEL_all_tag_group_id_names,tagGroupsData,/reading/all-tag-group-id-names,tag-group/name/read,Tag Group ID::Tag Group Name,Tag Group ID;List Position,All Tag Group Names,,reader,,transactionMessage;transactionStatus,,Selects all tag group name details.,
all-tag-group-links,reading.usp_SEL_all_tag_group_links,linksData,/reading/all-tag-group-links,tag-group/links/read,Tag ID::Tag Name;Tag Group ID::Tag Group Name,Tag ID;Tag Group ID,All Tag Group Links,,reader,,transactionMessage;transactionStatus,,Selects the data for all tag to tag group links.,
all-tag-tree-names,reading.usp_SEL_all_tag_tree_names,treeNamesData,/reading/all-tag-tree-names,tag-tree/names/read,Tag Tree ID::Tag Tree Name,Tag Tree ID;List Position,All Tag Relationship Tree Names,,reader,,transactionMessage;transactionStatus,,Selects the records for all tag tree names.,
all-tags,reading.usp_SEL_all_tags,tagsData,/reading/all-tags,tags/read,Tag ID::Tag Name,Tag ID,All Tags,,reader,,transactionMessage;transactionStatus,,Selects all tags.,
all-transaction-groups,reading.usp_SEL_all_transaction_groups,dropDownOptions,/reading/all-transaction-groups,transaction-groups/read,Transaction Group ID::Transaction Group Note,,All Transaction Groups,,reader,,transactionMessage;transactionStatus,,Selects all transaction groups,
all-units-of-measure,reading.usp_SEL_all_units_of_measure,resultSets,/reading/units-of-measure,units-of-measure/read,Units ID::Unit,Units ID;Position,Units of Measure,,reader,,transactionMessage;transactionStatus,,Lists all units of measure,
browsing-tree-by-id,reading.usp_SEL_browsing_tree_by_id,tagsData,/reading/browsing-tree-by-id,tag/browsing-tree/tags/read,Tag ID::Tag Name;Tag Browsing Tree Node ID::Tag Browsing Tree Node ID;Tag Browsing Tree HierarchyId::Tag Browsing Tree HierarchyId;Tag Browsing Tree ID::Tag Browsing Tree ID,Tag ID;Tag Browsing Tree ID,Browsing Tree By ID.,,reader,tagBrowsingTreeId,transactionMessage;transactionStatus,Tag Browsing Tree ID: | tagBrowsingTreeId,Selects all of the tags for a given tag browsing tree ID.,
browsing-tree-names,reading.usp_SEL_browsing_tree_names,browsingTreeNames,/reading/browsing-tree/names/read,tag/browsing-tree/names/read,Tag Browsing Tree ID::Tag Browsing Tree Name;User ID::System Username,Tag Browsing Tree ID;List Position;User ID,Browsing Tree Names,,reader,,transactionMessage;transactionStatus,,Selects all tag browsing tree name details.,
brsng-trees-wth-ed-prm,reading.usp_SEL_brsng_trees_wth_ed_prm,ResultSets,/reading/brsng-trees-wth-ed-prm,tag/browsing-tree/edit-permission/read,Tag Browsing Tree ID::Tag Browsing Tree Name;User ID::System Username,Tag Browsing Tree ID;List Position;User ID,Browsing Trees With Edit Permission,List Position::ASC,reader,,transactionMessage;transactionStatus,,Selects all tag browsing tree details which the connected user has edit permission for.,
com-obj-attributes,reading.usp_SEL_com_obj_attributes,attributeData,/reading/com-obj-attributes,common-object/attribute/read,Common Object Attribute ID::Common Object Attribute Name,Common Object Attribute ID,Common Object Attributes,,reader,,transactionMessage;transactionStatus,,Reads all common object attributes.,
com-obj-by-list,reading.usp_SEL_com_obj_by_list,dropDownOptions,/reading/com-obj-by-list,com-obj/read-by-list,Common Object ID::Common Object Name;Common Object Attribute ID::Common Object Attribute Name;Common Object List ID::Common Object List ID,Common Object ID;Common Object Attribute ID;Common Object List ID,Common Object By List,,reader,commonObjectListId,transactionMessage;transactionStatus,Common Object List : | commonObjectListId,Lists all common objects for a given list.,
common-object-list-names,reading.usp_SEL_com_obj_list_names,resultSets,/reading/common-object-list-names,common-object-list-names/read,Common Object List ID::Common Object List Name;Common Object Attribute ID::Common Object Attribute Name,Common Object List ID;Common Object Attribute ID,Common Object List Names,,reader,,transactionMessage;transactionStatus,,Lists all common object list names,
date-styles,reading.usp_SEL_date_styles,stylesData,/reading/date-styles,date-styles/read,Date Style::Date Style Format,List Position,Date Styles,,reader,,transactionMessage;transactionStatus,,Selects all date styles.,
docs-by-fnct-list-name,reading.usp_SEL_dc_by_fnct_list_name,documentData,/reading/docs-by-fnct-list-name,documents/function-list-name/read,Document ID::Document ID,,Documents By Function List Name Field,,reader,generalFieldNameId;filterGroupId;formId,transactionMessage;transactionStatus;numberOfRows;numberOfRecords;numberOfDocs;formName;filterGroupName, : | generalFieldNameId;filterGroupId;formId,Lists documents for a duty function list related general field name.  A filter group is applied.,TRUE
docs-by-ppl-list-name,reading.usp_SEL_dc_by_ppl_list_name,documentData,/reading/docs-by-ppl-list-name,documents/people-list-name/read,Document ID::Document ID,,Documents By People List Name Field,,reader,generalFieldNameId;filterGroupId;formId,transactionMessage;transactionStatus;numberOfRows;numberOfRecords;numberOfDocs;formName;filterGroupName, : | generalFieldNameId;filterGroupId;formId,Lists documents for a people list related general field name.  A filter group is applied.,TRUE
dc-cm-obj-ms-lnk-by-dc,reading.usp_SEL_dc_cm_obj_ms_lnk_by_dc,linksData,/reading/dc-cm-obj-ms-lnk-by-dc,document/common-object/multi-select/read,Common Object List ID::Common Object List Name;Common Object ID::Common Object Name;Common Object Attribute ID::Common Object Attribute Name;Document ID::Document ID,Common Object List ID;Common Object ID;Common Object Attribute ID;List Position;Document ID,Document Common Object Multi-Select Link By Document,,reader,documentId,transactionMessage;transactionStatus,By Document: | documentId,Lists all document common object multi-select list objects for a given document.,
dc-cm-obj-rb-lnk-by-dc,reading.usp_SEL_dc_cm_obj_rb_lnk_by_dc,linksData,/reading/dc-cm-obj-rb-lnk-by-dc,document/common-object/radio-button/document/read,Common Object List ID::Common Object List Name;Common Object ID::Common Object Name;Common Object Attribute ID::Common Object Attribute Name;Document ID::Document ID,Common Object List ID;Common Object ID;Common Object Attribute ID;List Position;Document ID,Document Common Object Radio Button Link By Document,,reader,documentId,transactionMessage;transactionStatus,By Document: | documentId,Lists all document common object radio button list objects for a given document.,
default-date-format,reading.usp_SEL_default_date_format,defaultDateFormat,/reading/default-date-format,defaults/read-date-format,Date Style::Date Style Format,,Default Date Format,,reader,,transactionMessage;transactionStatus,,List the default date format.,
doc-date-values-by-doc,reading.usp_SEL_doc_date_values_by_doc,dateFieldsData,/reading/doc-date-values-by-doc,document/date/read,Document Date Field Name ID:Document Date Field Name;Document ID::Document ID,Document Date Field Name ID;Document ID,Document Date Values By Document,,reader,documentId,transactionMessage;transactionStatus,By Document: | documentId,Lists all of the date values for a document.,
doc-file-form-values,reading.usp_SEL_doc_file_form_values,formValuesData,/reading/doc-file-form-values,forms/doc-file-form-values,Field Type::Field Type;Form Field Name ID::Form Field Name;Record Attribute ID::Value;Form ID::Form ID;Document ID::Document ID;File ID::File ID,Form Field Name ID;Record Name ID;Record Attribute ID;File ID,Document File Form Values,,reader,formId;documentId;fileId,transactionMessage;transactionStatus;numberOfRows;formName, : | formId;documentId;fileId,Lists all form fields and values for a given document and file pair.,
doc-group-names-rstr,reading.usp_SEL_doc_group_names_rstr,docGroupNamesRestricted,/document-group/name/restricted/read,document-group/name/restricted/read,Doc Group ID::Doc Group Name,Doc Group ID,Document Group Names Including Unrestricted,,reader,,transactionMessage;transactionStatus,,"Lists document group names which the connected user has rights to, including those that are unrestricted .",
doc-groups-by-doc-rstr,reading.usp_SEL_doc_groups_by_doc_rstr,resultSets,/reading/doc-groups-by-doc-rstr,document-groups/document-group/read,Doc Group ID::Doc Group Name;Document ID::Document ID,Doc Group ID;Document ID,Document Groups By Document Restricted. ,,reader,documentId,transactionMessage;transactionStatus,By Document: | documentId,Lists all document group names for a given document. Only lists those document groups for which the connected user has rights.,
doc-id-contains,reading.usp_SEL_doc_id_contains,documentData,/reading/doc-id-contains,document/id-contains/read,Document ID::Document ID,,Document ID Contains:,,reader,containsString;filterGroupId;formId,transactionMessage;transactionStatus;numDocs;filterGroupName;formName ,| containsString,Selects a filtered list of documents where the document ID contains a given string.,TRUE
doc-id-equals,reading.usp_SEL_doc_id_equals,documentData,/reading/doc-id-equals,document/docs-by-id-equals,Document ID::Document ID,,Document ID Equals:,,reader,documentId;filterGroupId;formId,transactionMessage;transactionStatus;numRows;numRecords;numDocs,By Document: | documentId,Selects an exact match for a given document ID.,TRUE
doc-int-values-by-doc,reading.usp_SEL_doc_int_values_by_doc,integerFieldsData,/reading/doc-int-values-by-doc,document/integer/values/doc/read,Document Integer Field Name ID::Document Integer Field Name;Document ID::Document ID,Document Integer Field Name ID;Document ID,Document Integer Values By Document,,reader,documentId,transactionMessage;transactionStatus,By Document: | documentId,Lists all the integer values for a given document.,
doc-ms-attr-by-doc,reading.usp_SEL_doc_ms_attr_by_doc,attributesData,/reading/doc-ms-attr-by-doc,document/multi-select/attribute/doc/read,Attribute Name ID::Attribute Name;Attribute Value ID::Attribute Value;Document ID::Document ID,Attribute Name ID;Attribute Value ID;Document ID,Document Multi-Select Attribute By Document. ,,reader,documentId,transactionMessage;transactionStatus,By Document: | documentId,Selects the multi-select attributes linked to a given document.,
doc-ms-attr-by-list,reading.usp_SEL_doc_ms_attr_by_list,dropDownOptions,/reading/doc-ms-attr-by-list,doc-attr/doc-ms-attr/read-by-list,Doc Multi-Select Attribute ID::Doc Multi-Select Attribute Name,Doc Multi-Select Attribute ID;List Position,Document Multi-Select Attribute By List:,,reader,docMultiSelectListId,transactionMessage;transactionStatus,| docMultiSelectListId,Selects mult-select list attribute records for a given attribute list.,
doc-ms-attr-fg-links,reading.usp_SEL_doc_ms_attr_fg_links,linksData,/reading/doc-ms-attr-fg-links,document/multi-select/attribute/filter-group/read,Doc Multi-Select Attribute ID::Doc Multi-Select Attribute Name;Filter Group ID::Filter Group Name,Doc Multi-Select Attribute ID;Filter Group ID,Document Multi-Select Attribute Filter Group Links,,reader,,transactionMessage;transactionStatus,,Outputs a list of document multi-select attribute to filter group links.,
doc-ms-list-not-linkd,reading.usp_SEL_doc_ms_list_not_linkd,listsData,/reading/doc-ms-list-not-linkd,document/multi-select/list/not-linked/read,Doc Multi-Select List ID::Doc Multi-Select List Name;Document ID::Document ID,Doc Multi-Select List ID;Document ID,Document Multi-Select List Not Linked,,reader,documentId,transactionMessage;transactionStatus,By Document: | documentId,Selects the multi-select list names which are not already linked to the given document.,
doc-radiob-attr-by-list,reading.usp_SEL_doc_radiob_attr_by_list,dropDownOptions,/reading/doc-radiob-attr-by-list,doc-attr/doc-rblist-attributes/read,Doc Radio Button Attribute ID::Doc Radio Button Attribute Name;Doc Radio Button List ID::Doc Radio Button List ID,Doc Radio Button Attribute ID;List Position;Doc Radio Button List ID,Document Radio Button Attribute By List:,,reader,docRadioButtonListId,transactionMessage;transactionStatus,Radio Button List: | docRadioButtonListId,Lists radio button attributes by list name,
doc-rb-attr-by-doc,reading.usp_SEL_doc_rb_attr_by_doc,attributesData,/reading/doc-rb-attr-by-doc,document/radio-button/attribute/doc/read,Doc Radio Button List ID::Doc Radio Button List Name;Doc Radio Button Attribute ID::Doc Doc Radio Button Attribute Name;Document ID::Document ID,Doc Radio Button List ID;Doc Radio Button Attribute ID;Document ID,Document Radio Button Attribute By Document,,reader,documentId,transactionMessage;transactionStatus,By Document: | documentId,Selects the radio button attributes linked to a given document.,
doc-rb-attr-fg-links,reading.usp_SEL_doc_rb_attr_fg_links,resultSets,/reading/doc-rb-attr-fg-links,document/radio-button/attribute/filter-group/link/read,Doc Radio Button Attribute ID::Doc Radio Button Attribute Name;Filter Group ID::Filter Group Name,Doc Radio Button Attribute ID;Filter Group ID,Document Radio Button Attribute Filter Group Links,,reader,,transactionMessage;transactionStatus,,Outputs a list of document radio button attribute to filter group links.,
doc-rb-list-not-linkd,reading.usp_SEL_doc_rb_list_not_linkd,listsData,/reading/doc-rb-list-not-linkd,document/radio-button/list/not-linked/read,Doc Radio Button List ID::Doc Radio Button List Name;Document ID::Document ID,Doc Radio Button List ID;Document ID,Document Radio Button List Not Linked,,reader,documentId,transactionMessage;transactionStatus,By Document: | documentId,Selects the radio button list names which are not already linked to the given document.,
doc-real-values-by-doc,reading.usp_SEL_doc_real_values_by_doc,realNumberData,/reading/doc-real-values-by-doc,document/real-values/doc/read,Document Real Number Field Name ID::Document Real Number Field Name;Document ID::Document ID,Document Real Number Field Name ID;Document ID,Document Real Values By Document,,reader,documentId,transactionMessage;transactionStatus,By Document: | documentId,List the real number values for a document.,
doc-text-values-by-doc,reading.usp_SEL_doc_text_values_by_doc,textFieldsData,/reading/doc-text-values-by-doc,document/text-value/doc/read,Document Free Text Field Name ID::Document Free Text Field Name;Document ID::Document ID,Document Free Text Field Name ID;Document ID,Document Text Values By Document,,reader,documentId,transactionMessage;transactionStatus,By Document: | documentId,Lists all the text values for a given document.,
