TableName,StoredProcedure,DataField,RouteUrl,ApiEndpoint,KeyColumns,HiddenColumns,DisplayName,DefaultSort,Role,InputParameters,OutputParameters,DisplayParameters,Description,UseTransform
all-doc-real-fields,reading.usp_SEL_all_doc_real_fields,fieldsData,/reading/all-doc-real-fields,document/real-number/names/read,Document Real Number Field Name ID::Document Real Number Field Name,Document Real Number Field Name ID,All Document Real Fields,,reader,,transactionMessage;transactionStatus,,List all document real number field names.,
all-doc-text-fields,reading.usp_SEL_all_doc_text_fields,textFieldsData,/reading/all-doc-text-fields,document/free-text/names/read,Document Free Text Field Name ID::Document Free Text Field Name,Document Free Text Field Name ID,All Document Text Fields,,reader,,transactionMessage;transactionStatus,,Selects all document free text field names.,
all-doc-xrefs-by-doc,reading.usp_SEL_all_doc_xrefs_by_doc,documentData,/reading/all-doc-xrefs-by-doc,document/cross-references/read,Document ID::Document ID,,All Document Xrefs By Document,,reader,documentId;crossReferenceTypeId;formId,transactionMessage;transactionStatus;numRows;numDocs,By Document: | documentId,Returns metadata for documents for a given document and cross reference type.,TRUE
all-docs-by-br-tr-node,reading.usp_SEL_all_docs_by_br_tr_node,documentData,/reading/all-docs-by-br-tr-node,documents/browsing-tree/read,Document ID::Document ID,,All Documents By Browsing Tree Node. ,,reader,tagBrowsingTreeNodeId;tagTreeId;tagDescendants;formId,transactionMessage;transactionStatus;numberOfRows;numberOfDocs,| tagBrowsingTreeNodeId,Selects all of the documents via selection of a browsing tree node.,TRUE
all-docs-by-co-ms-attr,reading.usp_SEL_all_docs_by_co_ms_attr,documentData,/reading/all-docs-by-co-ms-attr,document/common-object/read,Document ID::Document ID,,All Documents By Common Object Multi-Select Attribute,,reader,commonObjectListId;commonObjectId;formId,transactionMessage;transactionStatus,Common Object Attribute ID: | commonObjectId,Lists all the metadata for documents for a given common object multi-select attribute.,TRUE
all-docs-by-co-rb-attr,reading.usp_SEL_all_docs_by_co_rb_attr,documentData,/reading/all-docs-by-co-rb-attr,document/common-object/radio-button/attribute/read,Document ID::Document ID,,All Documents By Common Object Radio Button Attribute,,reader,formId;commonObjectListId;commonObjectId,transactionMessage;transactionStatus;numRows;numDocs, : | formId;commonObjectListId;commonObjectId,Lists all the metadata for documents for a given common object radio button attribute. Does not list associated files and does not apply a filter group.,TRUE
all-docs-by-doc-group,reading.usp_SEL_all_docs_by_doc_group,documentData,/reading/all-docs-by-doc-group,document/document-group/read,Document ID::Document ID,,All Documents By Document Group,,reader,docGroupId;formId,transactionMessage;transactionStatus;numRows;numDocs,Document Group ID: | docGroupId,Lists all document IDs linked to a document group.,TRUE
all-docs-by-dty-funct,reading.usp_SEL_all_docs_by_dty_funct,documentData,/reading/all-docs-by-dty-funct,document/duty-function/read,Document ID::Document ID,,All Documents By Dty Funct,,reader,functionId;formId,transactionMessage;transactionStatus;numRows;numDocs, : | functionId;formId,Selects metadata for documents linked to a given duty function.  No filter group is applied.,TRUE
all-docs-by-file,reading.usp_SEL_all_docs_by_file,documentData,/reading/all-docs-by-file,all-docs-by-file/read,Document ID::Document ID,,All Documents By File,,reader,fileId;formId,transactionMessage;transactionStatus;numrows;numdocs;formName,:|fileId,Selects all documents associated with a specific file.,TRUE
all-docs-by-funct-lst,reading.usp_SEL_all_docs_by_funct_lst,documentData,/reading/all-docs-by-funct-lst,documents/function-list/read,Document ID::Document ID,,All Documents By Funct List,,reader,functionListId;formId,transactionMessage;transactionStatus;numRows;numDocs, : | functionListId;formId,Selects metadata for documents linked to a given function list.,TRUE
all-docs-by-people-lst,reading.usp_SEL_all_docs_by_people_lst,documentData,/reading/all-docs-by-people-lst,document/people-list/read,Document ID::Document ID,,All Documents By People List,,reader,peopleListId;formId,transactionMessage;transactionStatus;numRows;numDocs, : | peopleListId;formId,Selects metadata for documents linked to a given people list.,TRUE
all-docs-by-radio-btn,reading.usp_SEL_all_docs_by_radio_btn,documentData,/reading/all-docs-by-radio-btn,document/radio-button/read,Document ID::Document ID,,All Documents By Radio Button,,reader,docRadioButtonAttributeId;formId,transactionMessage;transactionStatus;numRows;numDocs,Radio Button: | docRadioButtonAttributeId,Selects all of the documents for a given document radio button attribute.,TRUE
all-docs-by-tag,reading.usp_SEL_all_docs_by_tag,documentData,/reading/all-docs-by-tag,document/tag/read,Document ID::Document ID,,All Documents By Tag,,reader,tagId;formId;tagTreeId;tagDescendants,transactionMessage;transactionStatus, : | tagId;formId;tagTreeId;tagDescendants,Returns document data linked to a given tag.,TRUE
all-docs-by-text-field,reading.usp_SEL_all_docs_by_text_field,documentData,/reading/all-docs-by-text-field,document/text-string/read,Document ID::Document ID,,All Documents By Text Field,,reader,docTextNameId;likeString;formId,transactionMessage;transactionStatus;numRows;numDocs, : | docTextNameId;likeString;formId,Selects a list of documents for a given text string and free text field ID.,TRUE
all-docs-date-after,reading.usp_SEL_all_docs_date_after,documentData,/reading/all-docs-date-after,document/date/after/read,Document ID::Document ID,,All Documents Date After,,reader,docDateNameId;dateValue;formId,transactionMessage;transactionStatus;numRows;numDocs,Doc Date Name ID: | docDateNameId,Returns metadata for documents and associated files where a date record is after a given date.  Does not apply a filter group.,TRUE
all-docs-by-date-any,reading.usp_SEL_all_docs_date_any,documentData,/documents/date/any/read,documents/date/any/read,Document ID::Document ID,,Any Documents Linked to Given Date Field,,reader,docDateNameId,transactionMessage;transactionStatus;numRows;numdocs,Doc Date Name ID: | docDateNameId,Lists all documents linked to a given date field.,TRUE
all-docs-date-before,reading.usp_SEL_all_docs_date_before,documentData,/reading/all-docs-date-before,document/date/before/read,Document ID::Document ID,,All Documents Date Before,,reader,docDateNameId;dateValue;formId,transactionMessage;transactionStatus;numRows;numDocs,Doc Date Name ID: | docDateNameId,Returns metadata for documents and associated files where a date record is before a given date. Doesn't apply a filter group.,TRUE
all-docs-date-between,reading.usp_SEL_all_docs_date_between,documentData,/reading/all-docs-date-between,document/date/between/read,Document ID::Document ID,,All Documents Date Between,,reader,docDateNameId;earlierDate;laterDate;formId,transactionMessage;transactionStatus;numRows;numDocs,Doc Date Name ID: | docDateNameId,Returns metadata for documents and associated files where a date record is between given dates.,TRUE
all-docs-date-equals,reading.usp_SEL_all_docs_date_equals,documentData,/reading/all-docs-date-equals,document/date/equals/read,Document ID::Document ID,,All Documents Date Equals,,reader,docDateNameId;dateValue;formId,transactionMessage;transactionStatus;numRows;numDocs,Doc Date Name ID: | docDateNameId,Returns metadata for documents and associated files where a date record is equal to a given date.,TRUE
all-docs-int-any,reading.usp_SEL_all_docs_int_any,documentData,/documents/int/any/read,documents/int/any/read,Document ID::Document ID,,Any Documents Linked to Given Integer Field,,reader,docIntNameId,transactionMessage;transactionStatus;numRows;numdocs,Integer Field: | docIntNameid,Lists all documents linked to a given integer field,TRUE
all-docs-int-between,reading.usp_SEL_all_docs_int_between,documentData,/reading/all-docs-int-between,document/integer/between/read,Document ID::Document ID,,All Documents Integer Between,,reader,docIntNameId;lowerIntValue;upperIntValue;formId,transactionMessage;transactionStatus;numRows;numDocs,Integer Field: | docIntNameid,Returns metadata for documents and associated files where the designated integer field is between two given values.,TRUE
all-docs-int-equals,reading.usp_SEL_all_docs_int_equals,documentData,/reading/all-docs-int-equals,document/integer/equals/read,Document ID::Document ID,,All Documents Integer Equals,,reader,docIntNameId;integerValue;formId,transactionMessage;transactionStatus;numRows;numDocs,Integer Field: | docIntNameid,Returns metadata for documents and associated files where the designated integer field is equal to the given value.,TRUE
all-docs-int-grtr-than,reading.usp_SEL_all_docs_int_grtr_than,documentData,/reading/all-docs-int-grtr-than,document/integer/greater-than/read,Document ID::Document ID,,All Documents Integer Grtr Than,,reader,docIntNameId;integerValue;formId,transactionMessage;transactionStatus;numRows;numDocs,Integer Field: | docIntNameid,Returns metadata for documents and associated files where the designated integer field is greater than the given value.,TRUE
all-docs-int-less-than,reading.usp_SEL_all_docs_int_less_than,documentData,/reading/all-docs-int-less-than,document/integer/less-than/read,Document ID::Document ID,,All Documents Integer Less Than,,reader,docIntNameId;integerValue;formId,transactionMessage;transactionStatus;numRows;numDocs,Integer Field: | docIntNameid,Returns metadata for documents and associated files where the designated integer field is less than the given value.,TRUE
all-docs-multi-sel-atr,reading.usp_SEL_all_docs_multi_sel_atr,documentData,/reading/all-docs-multi-sel-atr,document/multi-select/read,Document ID::Document ID,,All Documents Multi Select Attribute,,reader,docMultiSelectListId;docMultiSelectAttributeId;formId,transactionMessage;transactionStatus;numRows;numRecords;numDocs,Radio Button: | docRadioButtonAttributeId,Selects metadata for documents linked to a given mulit-select attribute.,TRUE
all-docs-real-any,reading.usp_SEL_all_docs_real_any,documentData,/documents/real/any/read,documents/real/any/read,Document ID::Document ID,,Any Documents Linked to Given Real Number Field,,reader,docRealNameId,transactionMessage;transactionStatus;numRows;numDocs,| docReadlnameId,Lists all documents linked to a given real number field,TRUE
all-docs-real-between,reading.usp_SEL_all_docs_real_between,documentData,/reading/all-docs-real-between,document/real/between/read,Document ID::Document ID,,All Documents Real Between,,reader,docRealNameId;lowerRealValue;upperRealValue;formId,transactionMessage;transactionStatus;numRows;numDocs,Name ID: | docReadlnameId; Lower Value: | lowerRealValue; Upper Value: | upperRealValue,Returns metadata for documents and associated files where a real number field is between two given values.,TRUE
all-docs-real-equals,reading.usp_SEL_all_docs_real_equals,documentData,/reading/all-docs-real-equals,document/real/equals/read,Document ID::Document ID,,All Documents Real Equals,,reader,docRealNameId;realNumberValue;formId,transactionMessage;transactionStatus;numRows;numDocs, : | docRealNameId;realNumberValue;formId,Returns metadata for documents and associated files where the designated real number field is equal to the given value.,TRUE
all-docs-real-greater,reading.usp_SEL_all_docs_real_greater,documentData,/reading/all-docs-real-greater,document/real/greater/read,Document ID::Document ID,,All Documents Real Greater,,reader,docRealNameId;realNumberValue;formId,transactionMessage;transactionStatus;numRows;numDocs, : | docRealNameId;realNumberValue;formId,Returns metadata for documents and associated files where the designated real number field is greater than the given value.,TRUE
all-docs-real-less,reading.usp_SEL_all_docs_real_less,documentData,/reading/all-docs-real-less,document/real/less-than/read,Document ID::Document ID,,All Documents Real Less,,reader,docRealNameId;realNumberValue;filterGroupId;formId,transactionMessage;transactionStatus;numRows;numDocs,Less Than: | docRealNameId,Returns metadata for documents and associated files where the designated real number field is less than the given value.,TRUE
all-docs-with-ed-perm,reading.usp_SEL_all_docs_with_ed_perm,documentData,/reading/all-docs-with-ed-perm,document/edit-permission/read,Document ID::Document ID,,All Documents With Edit Permission,,reader,formId,transactionMessage;transactionStatus;numRows;numDocs,| formId,Lists the metadata for all of the documents that the connected user has edit permission.,TRUE
all-documents,reading.usp_SEL_all_documents,documentData,/reading/all-documents,document/list-all-docs,Document ID::Document ID,,All Documents,,reader,formId,transactionMessage;transactionStatus;numberOfDocs,| formId,,TRUE
all-duty-fnct-sid-lnks,reading.usp_SEL_all_duty_fnct_sid_lnks,resultSets,/reading/all-duty-fnct-sid-lnks,duty-function/sid/read,Duty Function ID::Duty Function Name;User ID::System Username,Duty Function ID;User ID,All Duty Function Lnks,,reader,,transactionMessage;transactionStatus,,Lists all duty function to sid link records.,
all-duty-functions,reading.usp_SEL_all_duty_functions,dropDownOptions,/reading/all-duty-functions,duty-functions/read-all,Duty Function ID::Duty Function Name,Duty Function ID;List Position,All Duty Functions,,reader,,transactionMessage;transactionStatus,,Lists all duty function records.,
all-file-date-fields,reading.usp_SEL_all_file_date_fields,resultSets,/reading/all-file-date-fields,file/date/names/read,File Date Field Name ID::File Date Field Name,File Date Field Name ID,All File Date Fields,,reader,,transactionMessage;transactionStatus,,Lists all of the file date field names.,
all-file-int-fields,reading.usp_SEL_all_file_int_fields,fieldsData,/reading/all-file-int-fields,file/integer/names/read,File Integer Field Name ID::File Integer Field Name,File Integer Field Name ID,All File Integer Fields,,reader,,transactionMessage;transactionStatus,,Selects all file integer field names.,
all-file-ms-attributes,reading.usp_SEL_all_file_ms_attributes,attributesData,/reading/all-file-ms-attributes,file/multi-select/attribute/read,File Multi-Select List ID::File Multi-Select List Name;File Multi-Select Attribute ID::File Multi-Select Attribute Name,File Multi-Select List ID;File Multi-Select Attribute ID;Name List Position;List Position,All File Multi-Select Attributes,,reader,,transactionMessage;transactionStatus,,Lists all file multi-select attributes.,
all-file-ms-lists,reading.usp_SEL_all_file_ms_lists,listsData,/reading/all-file-ms-lists,file/multi-select/list/read,File Multi-Select List ID::File Multi-Select List Name,File Multi-Select List ID;List Position,All File Multi-Select Lists,,reader,,transactionMessage;transactionStatus,,Selects all file multi-select list names.,
all-file-radiob-attr,reading.usp_SEL_all_file_radiob_attr,attributesData,/reading/all-file-radiob-attr,file/radio-button/attributes/read,File Radio Button List ID::File Radio Button List Name;File Radio Button Attribute ID::File Radio Button Attribute Name,File Radio Button List ID;File Radio Button Attribute ID;Attribute List Position;Name List Position,All File Radio Button Attributes,,reader,,transactionMessage;transactionStatus,,Selects all file radio button attribute,
all-file-radiob-lists,reading.usp_SEL_all_file_radiob_lists,resultSets,/reading/all-file-radiob-lists,file/radio-button-list/names/read,File Radio Button List ID::File Radio Button List Name,File Radio Button List ID;List Position,All File Radio Button Lists,,reader,,transactionMessage;transactionStatus,,Selects all data from the file_radio_button_list_names table.,
all-file-real-fields,reading.usp_SEL_all_file_real_fields,fieldsData,/reading/all-file-real-fields,file/real-number/names/read,File Real Number Field Name ID::File Real Number Field Name,File Real Number Field Name ID,All File Real Fields,,reader,,transactionMessage;transactionStatus,,Lists all the file real number field names.,
all-file-text-fields,reading.usp_SEL_all_file_text_fields,resultSets,/reading/all-file-text-fields,file/free-text/names/read,File Free Text Field Name ID::File Free Text Field Name,File Free Text Field Name ID,All File Text Fields,,reader,,transactionMessage;transactionStatus,,Lists all of the file free text field names.,
list-all-files,reading.usp_SEL_all_files,fileData,/reading/all-files,file/list-all-files,File ID::Filename,FCBUID,List All Files,File Id,reader,formId,transactionMessage;transactionStatus;numberOfRows;numberOfFiles;formName,| formId,Lists all files,TRUE
all-files-by-dty-funct,reading.usp_SEL_all_files_by_dty_funct,fileData,/reading/all-files-by-dty-funct,file/duty-function/read,File ID::Filename,,All Files By Dty Funct,,reader,functionId;formId,transactionMessage;transactionStatus;numRows;numFiles;formName,,Selects file metadata for all the files for a given duty function.  No filter group is applied.,TRUE
all-files-by-file-grp,reading.usp_SEL_all_files_by_file_grp,fileData,/reading/all-files-by-file-grp,file/file-group/read,File ID::Filename,,All Files By File Group,,reader,fileGroupId;formId,transactionMessage;transactionStatus;numRows;numFiles, : | fileGroupId;formId,Lists the files linked to a given file group.,TRUE
all-files-by-filename,reading.usp_SEL_all_files_by_filename,fileData,/reading/all-files-by-filename,file/file-name/read,File ID::Filename,,All Files By Filename. ,,reader,likeString;formId,transactionMessage;transactionStatus;numberOfRows;numberOfFiles,| likeString,Selects file record data for files with a filename containing the given string.,TRUE
all-files-by-funct-lst,reading.usp_SEL_all_files_by_funct_lst,fileData,/reading/all-files-by-funct-lst,file/function-list/read,File ID::Filename,,All Files By Funct List,,reader,functionListId;formId,transactionMessage;transactionStatus;numRows;numFiles;formName,,Returns metadata for files for a given function list. No filter group is applied.,TRUE
all-files-by-ms-list,reading.usp_SEL_all_files_by_ms_list,fileData,/reading/all-files-by-ms-list,file/multi-select/read,File ID::Filename,,All Files By Multi-Select List,,reader,fileMultiSelectListId;fileMultiSelectAttributeId;formId,transactionMessage;transactionStatus;numRows;numFiles, : | fileMultiSelectListId;fileMultiSelectAttributeId;formId,Returns metadata for files where a linked to a given multi-select attribute. No filter group is applied.,TRUE
all-files-by-pple-list,reading.usp_SEL_all_files_by_pple_list,fileData,/reading/all-files-by-pple-list,file/people-list/read,File ID::Filename,,All Files By Pple List,,reader,peopleListId;formId,transactionMessage;transactionStatus;numRows;numFiles;formName,,Returns metadata for files for a given people list.,TRUE
all-files-by-radio-btn,reading.usp_SEL_all_files_by_radio_btn,fileData,/reading/all-files-by-radio-btn,file/radio-button/attribute/read,File ID::Filename,,All Files By Radio Btn,,reader,fileRadioButtonAttributeId;formId,transactionMessage;transactionStatus;numRows;numFiles, : | fileRadioButtonAttributeId;formId,Selects all of the files for a given radio button attribute. Does not apply a filter group.,TRUE
all-files-by-txt-field,reading.usp_SEL_all_files_by_txt_field,fileData,/reading/all-files-by-txt-field,file/text-field/read,File ID::Filename,,All Files By Txt Field,,reader,fileTextNameId;likeString;formId,transactionMessage;transactionStatus;numRows;numFiles, : | fileTextNameId;likeString;formId,Returns metadata for files where a given text field contains a given text string.,TRUE
all-files-contains,reading.usp_SEL_all_files_contains,fileData,/reading/all-files-contains,all-files-contains/read,File ID::Filename,,Unfiltered File Content Search by CONTAINS,,reader,containsString;formId,transactionMessage;transactionStatus;numrows;numfiles;formName;filterGroupName,Files containing: | containsString,Selects all files where content contains the specified string.,TRUE
all-files-contains-with-docs,reading.usp_SEL_all_files_contains,fileData,/reading/all-files-contains/with-docs,all-files-contains/read-with-docs,File ID::Filename,,Unfiltered File Content Search by CONTAINS,,reader,containsString;formId,transactionMessage;transactionStatus;numrows;numfiles;formName;filterGroupName,Files containing: | containsString,Selects all files where content contains the specified string.    Includes document data.,TRUE
all-files-containstabl,reading.usp_SEL_all_files_containstabl,fileData,/reading/all-files-containstabl,all-files-containstabl/read,File ID::Filename,,Unfiltered File Content Search by CONTAINSTABLE,,reader,containsString;formId,transactionMessage;transactionStatus;numrows;numfiles;formName;filterGroupName,Files containing: | containsString,Selects all files where content contains the specified string (table version).,TRUE
all-files-containstabl-with-docs,reading.usp_SEL_all_files_containstabl,fileData,/reading/all-files-containstabl/with-docs,all-files-containstabl/read-with-docs,File ID::Filename,,Unfiltered File Content Search by CONTAINSTABLE,,reader,containsString;formId,transactionMessage;transactionStatus;numrows;numfiles;formName;filterGroupName,Files containing: | containsString,Selects all files where content contains the specified string (table version).    Includes document data.,TRUE
all-files-date-after,reading.usp_SEL_all_files_date_after,fileData,/reading/all-files-date-after,file/date/after/read,File ID::Filename,,All Files Date After,,reader,fileDateNameId;dateValue;formId,transactionMessage;transactionStatus;numRows;numFiles, : | fileDateNameId;dateValue;formId,Returns metadata for files where a date record is after a given date.,TRUE
all-files-by-date-any,reading.usp_SEL_all_files_date_any,fileData,/files/date/any/read,files/date/any/read,File ID::Filename,,Any Files Linked to Given Date Field,,reader,fileDateNameId,transactionMessage;transactionStatus;numRows;numFiles, : | fileDateNameId,Lists all files linked to a given date field.,TRUE
all-files-date-before,reading.usp_SEL_all_files_date_before,fileData,/reading/all-files-date-before,file/date/before/read,File ID::Filename,,All Files Date Before,,reader,fileDateNameId;dateValue;formId,transactionMessage;transactionStatus;numRows;numFiles, : | fileDateNameId;dateValue;formId,Returns metadata for files where a date record is before a given date.,TRUE
all-files-date-between,reading.usp_SEL_all_files_date_between,fileData,/reading/all-files-date-between,file/date/between/read,File ID::Filename,,All Files Date Between,,reader,fileDateNameId;earlierDate;laterDate;formId,transactionMessage;transactionStatus;numRows;numFiles, : | fileDateNameId;earlierDate;laterDate;formId,Returns metadata for files where a date record is between given dates.,TRUE
all-files-date-equals,reading.usp_SEL_all_files_date_equals,fileData,/reading/all-files-date-equals,file/date/equals/read,File ID::Filename,,All Files Date Equals,,reader,fileDateNameId;dateValue;formId,transactionMessage;transactionStatus;numRows;numFiles, : | fileDateNameId;dateValue;formId,Returns metadata for files where a date record equals a given date.,TRUE
all-files-for-one-doc,reading.usp_SEL_all_files_for_one_doc,fileData,/reading/all-files-for-one-doc,document/all-files-for-one-document,File ID::Filename,,This is an unfiltered list of files.,,reader,documentId;formId,transactionMessage;transactionStatus;numberOfFiles,Files for document: | documentId,Lists file metdata of all the files linked to the document id.,TRUE
all-files-freetext,reading.usp_SEL_all_files_freetext,fileData,/reading/all-files-freetext,all-files-freetext/read,File ID::Filename,,Unfiltered File Content Search by FREETEXT,,reader,containsString;formId,transactionMessage;transactionStatus;numrows;numfiles;formName;filterGroupName,Files containing: | containsString,Selects all files using freetext search on content.,TRUE
all-files-freetext-with-docs,reading.usp_SEL_all_files_freetext,fileData,/reading/all-files-freetext/with-docs,all-files-freetext/read-with-docs,File ID::Filename,,Unfiltered File Content Search by FREETEXT,,reader,containsString;formId,transactionMessage;transactionStatus;numrows;numfiles;formName;filterGroupName,Files containing: | containsString,Selects all files using freetext search on content.    Includes document data.,TRUE
all-files-freetexttabl,reading.usp_SEL_all_files_freetexttabl,fileData,/reading/all-files-freetexttabl,all-files-freetexttabl/read,File ID::Filename,,Unfiltered File Content Search by FREETEXTTABLE,,reader,containsString;formId,transactionMessage;transactionStatus;numrows;numfiles;formName;filterGroupName,Files containing: | containsString,Selects all files using freetext search on content (table version).,TRUE
all-files-freetexttabl-with-docs,reading.usp_SEL_all_files_freetexttabl,fileData,/reading/all-files-freetexttabl/with-docs,all-files-freetexttabl/read-with-docs,File ID::Filename,,Unfiltered File Content Search by FREETEXTTABLE,,reader,containsString;formId,transactionMessage;transactionStatus;numrows;numfiles;formName;filterGroupName,Files containing: | containsString,Selects all files using freetext search on content (table version).    Includes document data.,TRUE
all-files-int-any,reading.usp_SEL_all_files_int_any,fileData,/files/int/any/read,files/int/any/read,File ID::Filename,,Any Files Linked to Given Integer Field,,reader,fileIntNameId,transactionMessage;transactionStatus;numRows;numFiles, : | fileIntNameId,Lists all files linked to a given integer field,TRUE
